company,website,phone,address,categories,rating,industry,location,accredited,bbb_link,source
"Jackson Elite Tax & Consulting, LLC",,(303) 993-6427,3425 E 28th Ave,"Tax Return Preparation, Tax Consultant, Accountant ...",,Accountant,"Denver, CO",True,https://www.bbb.org/us/co/denver/profile/tax-return-preparation/jackson-elite-tax-consulting-llc-1296-90270469,bbb.org
"Servicios Ferver, Inc.",,(303) 727-8410,110 Federal Blvd Unit A,"Tax Return Preparation, Accountant",,Accountant,"Denver, CO",True,https://www.bbb.org/us/co/denver/profile/tax-return-preparation/servicios-ferver-inc-1296-90114131,bbb.org
Boxelder Consulting LLC,,(303) 317-6111,1325 S Colorado Blvd Ste B606,"Tax Consultant, Tax Return Preparation, Accountant ...",,Accountant,"Denver, CO",True,https://www.bbb.org/us/co/denver/profile/tax-consultant/boxelder-consulting-llc-1296-90230214,bbb.org
LCM Property Management Inc,,(303) 221-1117,1776 S Jackson St Ste 300,"Property Management, Accountant, Association Management",,Accountant,"Denver, CO",True,https://www.bbb.org/us/co/denver/profile/property-management/lcm-property-management-inc-1296-9035431,bbb.org
Fusion Legal & Tax,,(720) 922-1120,2000 S Colorado BLVD Tower 1 suite 2000-632,"Tax Attorney, Tax Return Preparation, Tax Consultant ...",A+,Accountant,"Denver, CO",True,https://www.bbb.org/us/co/denver/profile/tax-attorney/fusion-legal-tax-1296-90106580/addressId/809023,bbb.org
Latin Tax Center,,(303) 935-8100,6075 E 60th Ave,"Tax Representatives, Tax Return Preparation, Tax Consultant ...",,Accountant,"Denver, CO",True,https://www.bbb.org/us/co/commerce-city/profile/tax-representative/latin-tax-center-1296-1000187675,bbb.org
"Carlos Klinger & Sons, Inc.",,(720) 859-7168,1448 Kenton St,"Accountant, Tax Return Preparation, Tax Consultant ...",,Accountant,"Denver, CO",True,https://www.bbb.org/us/co/aurora/profile/accountant/carlos-klinger-sons-inc-1296-1000106588,bbb.org
"Legacy Tax & Accounting Solutions, LLC",,(303) 500-7703,7535 E Hampden Ave Ste 400,"Tax Enrolled Agent, Accountant",,Accountant,"Denver, CO",True,https://www.bbb.org/us/co/denver/profile/tax-enrolled-agent/legacy-tax-accounting-solutions-llc-1296-1000175316,bbb.org
"Frank Rim, CPA, P.C.",,(303) 323-8580,10200 E Girard Ave Ste 225 Bldg B,"CPA, Tax Return Preparation, Tax Consultant ...",,Accountant,"Denver, CO",True,https://www.bbb.org/us/co/denver/profile/cpa/frank-rim-cpa-pc-1296-90259665,bbb.org
"Charles M. Ertel, CPA, LLC",,(315) 663-1969,200 Union Blvd Ste 200,"CPA, Tax Return Preparation, Tax Consultant ...",,Accountant,"Denver, CO",True,https://www.bbb.org/us/co/lakewood/profile/cpa/charles-m-ertel-cpa-llc-1296-1000162023,bbb.org
Russell Lester CPA Inc.,,(303) 420-6789,9101 Harlan St Unit 270,"CPA, Tax Return Preparation, Tax Consultant ...",,Accountant,"Denver, CO",True,https://www.bbb.org/us/co/westminster/profile/cpa/russell-lester-cpa-inc-1296-90095463,bbb.org
Mundo Tax LLC,,(720) 573-8724,10660 E Bethany Dr Bldg 2 Ste 16,"Tax Consultant, Accountant, Bookkeeping Services ...",,Accountant,"Denver, CO",True,https://www.bbb.org/us/co/aurora/profile/tax-consultant/mundo-tax-llc--1296-90260534,bbb.org
"Janet Cronk, CPA, PC",,(303) 429-9238,9270 W 83rd Pl,"Tax Consultant, Accountant, CPA ...",,Accountant,"Denver, CO",True,https://www.bbb.org/us/co/arvada/profile/tax-consultant/janet-cronk-cpa-pc-1296-90136381,bbb.org
Haynie & Company,,(801) 972-4800,"Haynie
&amp; Haynie
&amp; UCompany began in 1960 in Salt Lake City. We now have locations across AZ,
CO, NV, TX, and UT. Our goal is to Exceed Expectations.Company began in 1960 in Salt Lake City. We now have locations across AZ,
CO, NV, TX, and UT. Our goal is to Exceed Expectations.","CPA, Business Consultants, Accountant ...",A+,Accountant,"Denver, CO",True,https://www.bbb.org/us/co/littleton/profile/cpa/haynie-company-1296-90118011/addressId/680139,bbb.org
Integrity Tax Group,,(303) 504-9757,9085 E Mineral Cir Ste 360,"CPA, Tax Return Preparation, Tax Consultant ...",,Accountant,"Denver, CO",True,https://www.bbb.org/us/co/centennial/profile/cpa/integrity-tax-group-1296-90253639,bbb.org
"Redwood Bookkeeping & Tax Services, Inc.",,(720) 388-1231,1490 W 121st Ave Ste 203,"Tax Consultant, Tax Return Preparation, Accountant ...",,Accountant,"Denver, CO",True,https://www.bbb.org/us/co/denver/profile/tax-consultant/redwood-bookkeeping-tax-services-inc-1296-90257410,bbb.org
"Brock and Company, CPA'S P.C.",,(303) 444-2971,12050 Pecos St Ste 210,"CPA, Tax Return Preparation, Accountant",A+,Accountant,"Denver, CO",True,https://www.bbb.org/us/co/westminster/profile/cpa/brock-and-company-cpas-pc-1296-1000168373/addressId/804802,bbb.org
Lutz Hoenig CPAs,,(303) 794-8171,88 Inverness Cir E Unit L101,"CPA, Tax Return Preparation, Tax Consultant ...",,Accountant,"Denver, CO",True,https://www.bbb.org/us/co/englewood/profile/cpa/lutz-hoenig-cpas-1296-64015081,bbb.org
"Zick Business Advisors, Inc",,(303) 758-9167,16 Inverness Pl E Bldg C,"Tax Consultant, Tax Return Preparation, Accountant ...",,Accountant,"Denver, CO",True,https://www.bbb.org/us/co/englewood/profile/tax-consultant/zick-business-advisors-inc-1296-90140237,bbb.org
"Klein Accounting, LLC",,(303) 396-2167,9609 S University Blvd,"Accountant, Tax Return Preparation, Bookkeeping Services ...",A+,Accountant,"Denver, CO",True,https://www.bbb.org/us/co/littleton/profile/accountant/klein-accounting-llc-1296-90221715/addressId/696544,bbb.org
"Amy E. Kozleski, CPA",,(720) 475-1798,,"CPA, Accountant",A+,Accountant,"Denver, CO",True,https://www.bbb.org/us/co/parker/profile/cpa/amy-e-kozleski-cpa-1296-90112260/addressId/827236,bbb.org
Williamson & Co. P.C.,,(303) 604-0829,400 S McCaslin Blvd Ste 205,"CPA, Accountant",,Accountant,"Denver, CO",True,https://www.bbb.org/us/co/louisville/profile/cpa/williamson-co-pc-1296-90091832,bbb.org
Advance Cash Tax Service LLC,,(720) 685-7468,17 S 6th Ave,"Tax Consultant, Tax Return Preparation, Accountant ...",,Accountant,"Denver, CO",True,https://www.bbb.org/us/co/brighton/profile/tax-consultant/advance-cash-tax-service-llc-1296-90156608,bbb.org
Wayne Ruegge CPA PC,,(720) 204-1040,7501 Village Square Dr Ste 103,"CPA, Tax Return Preparation, Accountant",,Accountant,"Denver, CO",True,https://www.bbb.org/us/co/castle-pines/profile/cpa/wayne-ruegge-cpa-pc-1296-90155011,bbb.org
Flynn CPA LLC,,(303) 970-9698,6999 Copper Sky Cir,"CPA, Accountant, Accounting ...",,Accountant,"Denver, CO",True,https://www.bbb.org/us/co/castle-pines/profile/cpa/flynn-cpa-llc-1296-1000164658,bbb.org
Marcolina Tax & Accounting,,(303) 975-6981,,"Tax Consultant, Tax Return Preparation, Accountant ...",,Accountant,"Denver, CO",True,https://www.bbb.org/us/co/golden/profile/tax-consultant/marcolina-tax-accounting-1296-1000111890,bbb.org
"Robert & Associates, LLC",,(303) 231-1045,31207 Keats Way Ste 205,"CPA, Accountant",,Accountant,"Denver, CO",True,https://www.bbb.org/us/co/evergreen/profile/cpa/robert-associates-llc-1296-90150988,bbb.org
L & L Tax Service,,(303) 665-8422,1017 S Boulder Rd Ste E2,"Tax Return Preparation, Accountant",,Accountant,"Denver, CO",True,https://www.bbb.org/us/co/louisville/profile/tax-return-preparation/l-l-tax-service-1296-34000543,bbb.org
Henry Waters & Associates Inc,,(303) 494-4050,4740 Table Mesa Dr STE A,"Accountant, Tax Consultant, Payroll Services ...",,Accountant,"Denver, CO",True,https://www.bbb.org/us/co/boulder/profile/accountant/henry-waters-associates-inc-1296-90143250,bbb.org
David Brewster & Associates Inc,,(303) 449-5320,4890 Riverbend Rd,"Tax Return Preparation, Accountant",,Accountant,"Denver, CO",True,https://www.bbb.org/us/co/boulder/profile/tax-return-preparation/david-brewster-associates-inc-1296-2015315,bbb.org
NFP Partners,,(303) 775-5620,,"Accountant, Tax Consultant, Business Services ...",,Accountant,"Denver, CO",True,https://www.bbb.org/us/co/hudson/profile/accountant/nfp-partners-0805-46123247,bbb.org
"Anna Reid, CPA",,(303) 915-1706,4886 State Highway 66,"CPA, Tax Return Preparation, Tax Consultant ...",,Accountant,"Denver, CO",True,https://www.bbb.org/us/co/mead/profile/cpa/anna-reid-cpa-0805-46152408,bbb.org
Red Hawk Tax Resolution,,(720) 280-4574,,"CPA, Tax Return Preparation, Tax Consultant ...",,Accountant,"Denver, CO",True,https://www.bbb.org/us/co/castle-rock/profile/cpa/red-hawk-tax-resolution-1296-1000184095,bbb.org
Pearl Accounting Services,,(720) 745-0966,,"Accounting, Business Services, Accountant ...",,Accountant,"Denver, CO",True,https://www.bbb.org/us/co/berthoud/profile/accounting/pearl-accounting-services-0805-46131519,bbb.org
"QuickBalance, LLC",,(970) 690-8996,,"Bookkeeping Services, Accountant, Payroll Services",,Accountant,"Denver, CO",True,https://www.bbb.org/us/co/johnstown/profile/bookkeeping-services/quickbalance-llc-0805-46100276,bbb.org
The Spencer Group,,(970) 578-0510,130 Becker Circle,"Taxes, Tax Return Preparation, Accountant ...",,Accountant,"Denver, CO",True,https://www.bbb.org/us/co/johnstown/profile/taxes/the-spencer-group-0805-46145776,bbb.org
Macy Tax and Bookkeeping,,(970) 462-1277,,"Bookkeeping Services, Tax Return Preparation, Tax Consultant ...",,Accountant,"Denver, CO",True,https://www.bbb.org/us/co/johnstown/profile/bookkeeping-services/macy-tax-and-bookkeeping-0805-46114591,bbb.org
"Accountants Cabin, LLC",,(970) 556-2937,229 E 10th St,"Accountant, Tax Return Preparation, Tax Consultant ...",,Accountant,"Denver, CO",True,https://www.bbb.org/us/co/loveland/profile/accountant/accountants-cabin-llc-0805-46115866,bbb.org
Foundation Financial & Accounting Services LLC,,(970) 786-0220,,"Bookkeeping Services, Accountant, Payroll Services ...",,Accountant,"Denver, CO",True,https://www.bbb.org/us/co/greeley/profile/bookkeeping-services/foundation-financial-accounting-services-llc-0805-46100062,bbb.org
Guerrero Mobile Mechanics,,(346) 266-0849,3626 N Hall St Ste 610,"Mobile Auto Repair, Mobile Auto Lube and Oil",,Auto Repair,"Dallas, TX",True,https://www.bbb.org/us/tx/dallas/profile/mobile-auto-repair/guerrero-mobile-mechanics-0875-91349324,bbb.org
Planet Ford Dallas,,(214) 296-4416,3333 Inwood Rd,"New Car Dealers, Used Car Dealers, Auto Body Repair and Painting ...",,Auto Repair,"Dallas, TX",True,https://www.bbb.org/us/tx/dallas/profile/new-car-dealers/planet-ford-dallas-0875-4004182,bbb.org
"Lovers Lane European Automotive, LLC",,(214) 350-0805,5111 W Lovers Ln Ste A,"Foreign Auto Repair, Auto Repairs, Auto Air Conditioning ...",,Auto Repair,"Dallas, TX",True,https://www.bbb.org/us/tx/dallas/profile/foreign-auto-repair/lovers-lane-european-automotive-llc-0875-37004746,bbb.org
Clay Cooley Volkswagen of Park Cities,,(469) 336-6750,5555 Lemmon Ave,"New Car Dealers, Auto Body Repair and Painting, Auto Repairs ...",,Auto Repair,"Dallas, TX",True,https://www.bbb.org/us/tx/dallas/profile/new-car-dealers/clay-cooley-volkswagen-of-park-cities-0875-90712410,bbb.org
Pro Automotive Reconditioning,,(214) 531-3611,9233 Denton Dr Ste 200,"Auto Body Repair and Painting, Auto Repairs, Auto Detailing ...",,Auto Repair,"Dallas, TX",True,https://www.bbb.org/us/tx/dallas/profile/auto-body-repair-and-painting/pro-automotive-reconditioning-0875-91348026,bbb.org
"Gaal's Euro Automotive, Inc.",,(214) 956-7744,3421 W Northwest Hwy,"Auto Repairs, Foreign Auto Repair",,Auto Repair,"Dallas, TX",True,https://www.bbb.org/us/tx/dallas/profile/auto-repair/gaals-euro-automotive-inc-0875-50000484,bbb.org
Lone Star Engine Installation,,(214) 821-0692,405 Ann Ave,"Rebuilt Engines, Auto Repairs, Small Engine Repair ...",,Auto Repair,"Dallas, TX",True,https://www.bbb.org/us/tx/dallas/profile/rebuilt-engines/lone-star-engine-installation-0875-3000330,bbb.org
"Lindberg Collision, Inc.",,(214) 637-3368,8920 John Carpenter Fwy,"Auto Body Repair and Painting, Auto Repairs, Auto Detailing ...",,Auto Repair,"Dallas, TX",True,https://www.bbb.org/us/tx/dallas/profile/auto-body-repair-and-painting/lindberg-collision-inc-0875-90117241,bbb.org
"Engine Rebuilders, LLC",,(214) 237-4415,3540 Irving Blvd,"Transmission, Rebuilt Engines, Truck Repair ...",,Auto Repair,"Dallas, TX",True,https://www.bbb.org/us/tx/dallas/profile/transmission/engine-rebuilders-llc-0875-90234615,bbb.org
Freeway Tire Shop,,(214) 267-2500,3110 N Stemmons Fwy,"Tire Repair, Auto Inspection Stations, Auto Services ...",,Auto Repair,"Dallas, TX",True,https://www.bbb.org/us/tx/dallas/profile/tire-repair/freeway-tire-shop-0875-91127109,bbb.org
Northside Collision Center,,7523475235,11345 Denton Dr,Auto Body Repair and Painting,,Auto Repair,"Dallas, TX",True,https://www.bbb.org/us/tx/dallas/profile/auto-body-repair-and-painting/northside-collision-center-0875-90314934,bbb.org
"Louden Motorcar Services, Inc.",,(972) 241-6326,11454 Reeder Rd,"Auto Repairs, Foreign Auto Repair, Auto Diagnosis",,Auto Repair,"Dallas, TX",True,https://www.bbb.org/us/tx/dallas/profile/auto-repair/louden-motorcar-services-inc-0875-1602,bbb.org
"Dennis Road Automotive, Inc.",,(972) 241-1901,11155 Dennis Rd,"Auto Repairs, Auto Maintenance, Auto Air Conditioning ...",,Auto Repair,"Dallas, TX",True,https://www.bbb.org/us/tx/dallas/profile/auto-repair/dennis-road-automotive-inc-0875-7282,bbb.org
"Blaine's Motor Supply, Inc.",,(214) 426-4400,4700 Scyene Rd,Rebuilt Engines,,Auto Repair,"Dallas, TX",True,https://www.bbb.org/us/tx/dallas/profile/rebuilt-engines/blaines-motor-supply-inc-0875-11919,bbb.org
"Always A-Way Automotive, LLC",,(214) 230-3030,2555 Walnut Hill Ln STE 100,"Used Car Dealers, Auto Body Repair and Painting, Auto Financing",,Auto Repair,"Dallas, TX",True,https://www.bbb.org/us/tx/dallas/profile/used-car-dealers/always-a-way-automotive-llc-0875-91146673,bbb.org
Highland Auto Center,,(972) 233-8882,10524 E Northwest Hwy,"Auto Repairs, Auto Body Repair and Painting, Auto Inspection Stations ...",,Auto Repair,"Dallas, TX",True,https://www.bbb.org/us/tx/dallas/profile/auto-repair/highland-auto-center-0875-90066097,bbb.org
All-Star Inflatables Inc.,,(972) 272-4191,11120 Grader St,"Amusement Devices, Fire Safety Equipment, Bounce Houses ...",,Auto Repair,"Dallas, TX",True,https://www.bbb.org/us/tx/dallas/profile/amusement-devices/all-star-inflatables-inc-0875-43001164,bbb.org
Liberty Hail Inc.,,(469) 310-0005,11221 Gemini Ln,"Paintless Dent Repair, Auto Detailing",,Auto Repair,"Dallas, TX",True,https://www.bbb.org/us/tx/dallas/profile/paintless-dent-repair/liberty-hail-inc-0875-91348568,bbb.org
Divine Dallas Dent,,(972) 430-3266,11325 Gemini Ln Ste 110,"Paintless Dent Repair, Auto Repairs",,Auto Repair,"Dallas, TX",True,https://www.bbb.org/us/tx/dallas/profile/paintless-dent-repair/divine-dallas-dent-0875-91339944,bbb.org
"The Hondew Shop, Inc.",,(972) 437-9520,13664 Floyd Cir,"Auto Repairs, Auto Air Conditioning, Foreign Auto Repair ...",,Auto Repair,"Dallas, TX",True,https://www.bbb.org/us/tx/dallas/profile/auto-repair/the-hondew-shop-inc-0875-15897,bbb.org
DFW Auto Financing LLC,,(972) 449-0491,13715 Floyd Cir,"BHPH Dealers, Used Car Dealers, Auto Body Repair and Painting ...",A+,Auto Repair,"Dallas, TX",True,https://www.bbb.org/us/tx/dallas/profile/buy-here-pay-here-auto-dealer/dfw-auto-financing-llc-0875-90804118/addressId/118870,bbb.org
Clay Cooley Chevrolet of Dallas,,(469) 251-7325,9301 E R L Thornton Fwy,"New Car Dealers, Used Car Dealers, Auto Repairs ...",,Auto Repair,"Dallas, TX",True,https://www.bbb.org/us/tx/dallas/profile/new-car-dealers/clay-cooley-chevrolet-of-dallas-0875-90800879,bbb.org
Dent Mechanic Group,,(972) 379-2348,11333 Emerald St,"Car Dent Repair, Auto Body Repair and Painting, Windshield Repair ...",,Auto Repair,"Dallas, TX",True,https://www.bbb.org/us/tx/dallas/profile/car-dent-repair/dent-mechanic-group-0875-90795181,bbb.org
"Dallas Dent Company, LLC",,(214) 734-9682,11451 Reeder Rd,"Car Dent Repair, Auto Body Repair and Painting, Auto Detailing ...",,Auto Repair,"Dallas, TX",True,https://www.bbb.org/us/tx/dallas/profile/car-dent-repair/dallas-dent-company-llc-0875-91020485,bbb.org
House of Colour,,(214) 637-2468,2310 Jim St,"Auto Body Repair and Painting, Truck Lettering",,Auto Repair,"Dallas, TX",True,https://www.bbb.org/us/tx/dallas/profile/auto-body-repair-and-painting/house-of-colour-0875-19001263,bbb.org
Car Code Solutions,,(872) 203-3134,1802 Reserve St STE B,"Electric Vehicle Repairs, Auto Body Repair and Painting, Auto Electric Services ...",,Auto Repair,"Dallas, TX",True,https://www.bbb.org/us/tx/garland/profile/electric-vehicle-repairs/car-code-solutions-0875-91353090,bbb.org
Toyota of Dallas,,(972) 241-6655,2610 Forest Ln,"New Car Dealers, Used Car Dealers, Auto Body Repair and Painting ...",,Auto Repair,"Dallas, TX",True,https://www.bbb.org/us/tx/dallas/profile/new-car-dealers/toyota-of-dallas-0875-17000603,bbb.org
Soto Diesel Repair,,(214) 554-0365,1004 Bluebonnet Dr,"Auto Repairs, Small Engine Repair, Auto Services ...",,Auto Repair,"Dallas, TX",True,https://www.bbb.org/us/tx/irving/profile/auto-repair/soto-diesel-repair-0875-91327748,bbb.org
Atlas Auto Body & Paint,,(972) 231-1486,405 S Central Expy STE 128,"Auto Body Repair and Painting, Windshield Repair",,Auto Repair,"Dallas, TX",True,https://www.bbb.org/us/tx/richardson/profile/auto-body-repair-and-painting/atlas-auto-body-paint-0875-19000626,bbb.org
SelectAutoHailRepair,,(945) 400-4908,401 S Sherman St Ste 109,"Paintless Dent Repair, Auto Body Repair and Painting",,Auto Repair,"Dallas, TX",True,https://www.bbb.org/us/tx/richardson/profile/paintless-dent-repair/select-auto-hail-repair-0875-91342995,bbb.org
"DC The Dent Center, LLC",,(866) 401-4245,15200 Midway Rd,"Car Dent Repair, Auto Body Repair and Painting, Mobile Auto Lube and Oil",,Auto Repair,"Dallas, TX",True,https://www.bbb.org/us/tx/addison/profile/car-dent-repair/dc-the-dent-center-llc-0875-90125860,bbb.org
"JDS Collision Repair, LLC",,(972) 721-0650,222 W Airport Fwy,"Auto Body Repair and Painting, Car Dent Repair, Hail Repair ...",,Auto Repair,"Dallas, TX",True,https://www.bbb.org/us/tx/irving/profile/auto-body-repair-and-painting/jds-collision-repair-llc-0875-90581127,bbb.org
Clay Cooley CJDR of Irving,,(469) 392-4562,1261 E Airport Fwy,"New Car Dealers, Used Car Dealers, Auto Body Repair and Painting ...",,Auto Repair,"Dallas, TX",True,https://www.bbb.org/us/tx/irving/profile/new-car-dealers/clay-cooley-cjdr-of-irving-0875-90463154,bbb.org
Clay Cooley Chevrolet of Irving,,(972) 848-9258,1251 E Airport Fwy,"New Car Dealers, Used Car Dealers, Auto Body Repair and Painting ...",,Auto Repair,"Dallas, TX",True,https://www.bbb.org/us/tx/irving/profile/new-car-dealers/clay-cooley-chevrolet-of-irving-0875-90463158,bbb.org
Clay Cooley Nissan of Irving,,(972) 554-2200,1000 E Airport Fwy,"New Car Dealers, Used Car Dealers, Auto Body Repair and Painting ...",,Auto Repair,"Dallas, TX",True,https://www.bbb.org/us/tx/irving/profile/new-car-dealers/clay-cooley-nissan-of-irving-0875-90717520,bbb.org
Toyota of Irving,,(972) 258-1200,1999 W Airport Fwy,"New Car Dealers, Used Car Dealers, Auto Body Repair and Painting ...",,Auto Repair,"Dallas, TX",True,https://www.bbb.org/us/tx/irving/profile/new-car-dealers/toyota-of-irving-0875-937,bbb.org
Clay Cooley Kia of Irving,,(469) 908-3790,1247 E Airport Fwy,"New Car Dealers, Used Car Dealers, Auto Repairs ...",,Auto Repair,"Dallas, TX",True,https://www.bbb.org/us/tx/irving/profile/new-car-dealers/clay-cooley-kia-of-irving-0875-90620459,bbb.org
Glass Doctor of Dallas Metroplex,,,2001 Midway Rd STE 121,"Glass Company, Window Installation, Window Glass ...",,Auto Repair,"Dallas, TX",True,https://www.bbb.org/us/tx/carrollton/profile/glass-company/glass-doctor-of-dallas-metroplex-0875-90006738,bbb.org
"Five Star Subaru of Grapevine, LLC",,(817) 438-1700,2070 Diplomat Dr,"New Car Dealers, Used Car Dealers, Auto Body Repair and Painting ...",,Auto Repair,"Dallas, TX",True,https://www.bbb.org/us/tx/farmers-branch/profile/new-car-dealers/five-star-subaru-of-grapevine-llc-0875-90798015,bbb.org
"1st Class Dent Repair, LLC",,(214) 560-0244,2631 S Garland Ave,"Hail Repair, Car Dent Repair, Paintless Dent Repair",,Auto Repair,"Dallas, TX",True,https://www.bbb.org/us/tx/garland/profile/hail-repair/1st-class-dent-repair-llc-0875-91140716,bbb.org
1st Class Collision Center,,(214) 227-4444,2631 S Garland Ave,"Auto Body Repair and Painting, Hail Repair",,Auto Repair,"Dallas, TX",True,https://www.bbb.org/us/tx/garland/profile/auto-body-repair-and-painting/1st-class-collision-center-0875-90530525,bbb.org
Randall Reed's Planet Ford 635,,(972) 864-3673,3601 S Shiloh Rd,"New Car Dealers, Used Car Dealers, Auto Inspection Stations ...",,Auto Repair,"Dallas, TX",True,https://www.bbb.org/us/tx/garland/profile/new-car-dealers/randall-reeds-planet-ford-635-0875-1822,bbb.org
Sure Shot Collision Repair,,(972) 494-1977,3578 Forest Ln,"Auto Body Repair and Painting, Car Dent Repair, Car Restorations",,Auto Repair,"Dallas, TX",True,https://www.bbb.org/us/tx/garland/profile/auto-body-repair-and-painting/sure-shot-collision-repair-0875-90407581,bbb.org
Carpenter's Cooling LLC,,(407) 595-5946,,"Air Conditioning Contractors, Heating and Air Conditioning, Air Duct Cleaning ...",,Cleaning Service,"Orlando, FL",True,https://www.bbb.org/us/fl/orlando/profile/air-conditioning-contractor/carpenters-cooling-llc-0733-90576132,bbb.org
Blue Air Heating and Cooling LLC,,(407) 300-4185,3725 Conway Rd Ste B,"Air Conditioning Contractors, Heating and Air Conditioning, Duct Cleaning ...",,Cleaning Service,"Orlando, FL",True,https://www.bbb.org/us/fl/orlando/profile/air-conditioning-contractor/blue-air-heating-and-cooling-llc-0733-235977935,bbb.org
One And Done Solutions LLC,,(561) 255-2773,,"Commercial Cleaning Services, Cleaning Services, Pressure Washing ...",,Cleaning Service,"Orlando, FL",True,https://www.bbb.org/us/fl/orlando/profile/commercial-cleaning-services/one-and-done-solutions-llc-0733-235962808,bbb.org
"A-Legend A/C Service, Inc.",,(407) 579-9458,,"Air Conditioning Contractors, Heating and Air Conditioning, Air Conditioning Repair ...",,Cleaning Service,"Orlando, FL",True,https://www.bbb.org/us/fl/orlando/profile/air-conditioning-contractor/a-legend-ac-service-inc-0733-90324952,bbb.org
Cooling Systems Inc.,,(407) 737-4592,5213 Heath Dr,"Air Conditioning Contractors, Heating and Air Conditioning, Air Conditioning Repair ...",A+,Cleaning Service,"Orlando, FL",True,https://www.bbb.org/us/fl/orlando/profile/air-conditioning-contractor/cooling-systems-inc-0733-184144082/addressId/149368,bbb.org
"Gary Munson Heating & A/C Service, Inc.",,(407) 859-1494,2230 Curry Frd Ste B,"Air Conditioning Contractors, Heating and Air Conditioning, Air Conditioning Repair ...",,Cleaning Service,"Orlando, FL",True,https://www.bbb.org/us/fl/orlando/profile/air-conditioning-contractor/gary-munson-heating-ac-service-inc-0733-38000081,bbb.org
"Philip White Painting and Restoration, LLC",,(407) 860-5846,,"Painting Contractors, Pressure Washing, Carpet and Rug Cleaners ...",,Cleaning Service,"Orlando, FL",True,https://www.bbb.org/us/fl/orlando/profile/painting-contractors/philip-white-painting-and-restoration-llc-0733-90413239,bbb.org
"Gold Key Roofing, LLC",,(407) 851-0680,4874 S Orange Ave,"Roofing Contractors, Metal Roofing Contractors, Commercial Roofing ...",,Cleaning Service,"Orlando, FL",True,https://www.bbb.org/us/fl/orlando/profile/roofing-contractors/gold-key-roofing-llc-0733-164712107,bbb.org
Helpro Cleaning Services,,(407) 516-1636,102 Drennen Rd Suite A6,"Cleaning Services, Pressure Washing, Carpet and Rug Cleaners ...",,Cleaning Service,"Orlando, FL",True,https://www.bbb.org/us/fl/orlando/profile/cleaning-services/helpro-cleaning-services-0733-90313584,bbb.org
"No Sweat A/C and Heating, LLC",,(407) 497-4259,1423 S Bumby Ave,"Air Conditioning Contractors, Air Conditioning Repair, Residential Air Conditioning Contractors ...",,Cleaning Service,"Orlando, FL",True,https://www.bbb.org/us/fl/orlando/profile/air-conditioning-contractor/no-sweat-ac-and-heating-llc-0733-90264661,bbb.org
"Century Air Conditioning & Heating, Inc.",,(407) 894-8417,1650 S Bumby Ave,"Air Conditioning Contractors, Heating and Air Conditioning, Air Conditioning Repair ...",,Cleaning Service,"Orlando, FL",True,https://www.bbb.org/us/fl/orlando/profile/air-conditioning-contractor/century-air-conditioning-heating-inc-0733-101820,bbb.org
Homes & Buildings Restoration LLC,,(407) 219-2039,1372 N Goldenrod Rd Ste 16,"Water Mitigation, Bathroom Remodel, Kitchen Remodel ...",,Cleaning Service,"Orlando, FL",True,https://www.bbb.org/us/fl/orlando/profile/water-mitigation/homes-buildings-restoration-llc-0733-235971495,bbb.org
Merry Maids,,(407) 331-5266,216 South Semoran Ave,"House Cleaning, Cleaning Services, Commercial Cleaning Services ...",A+,Cleaning Service,"Orlando, FL",True,https://www.bbb.org/us/fl/orlando/profile/house-cleaning/merry-maids-0733-202273/addressId/2003,bbb.org
Sharp Lawn Service,,(407) 493-8748,3936 S Semoran Blvd PMB 1104,"Lawn Maintenance, Painting Contractors, Tree Services ...",,Cleaning Service,"Orlando, FL",True,https://www.bbb.org/us/fl/orlando/profile/lawn-maintenance/sharp-lawn-service-0733-235966137,bbb.org
Method Roofing & Solar LLC,,(407) 605-5733,3208 E Colonial Dr PMB C447,"Residential Roofing, Roofing Contractors, Gutters ...",,Cleaning Service,"Orlando, FL",True,https://www.bbb.org/us/fl/orlando/profile/residential-roofing/method-roofing-solar-llc-0733-235960890,bbb.org
"Steamatic Of Central Florida, Inc.",,(407) 681-7277,6124 Hanging Moss RD #330,"Carpet and Rug Cleaners, House Cleaning, Cleaning Services ...",,Cleaning Service,"Orlando, FL",True,https://www.bbb.org/us/fl/orlando/profile/carpet-and-rug-cleaners/steamatic-of-central-florida-inc-0733-301336,bbb.org
"All American Water Restoration, Inc.",,(407) 704-8723,6330 Old Cheney Hwy,"Water Damage Restoration, Bathroom Remodel, House Cleaning ...",,Cleaning Service,"Orlando, FL",True,https://www.bbb.org/us/fl/orlando/profile/water-damage-restoration/all-american-water-restoration-inc-0733-141927757,bbb.org
