company,website,phone,address,categories,rating,industry,location,accredited,bbb_link,source
"Wechsler Development Group, LLC.",,(305) 525-8237,1735 Ponce De Leon Blvd,General Contractor,,General Contractor,"Miami, FL",True,https://www.bbb.org/us/fl/coral-gables/profile/general-contractor/wechsler-development-group-llc-0633-90611087,bbb.org
"Arvani Building Works, LLC",,(305) 803-0313,147 Alhambra Circle #241,"Residential General Contractor, Building Contractors, Remodeling ...",,General Contractor,"Miami, FL",True,https://www.bbb.org/us/fl/coral-gables/profile/residential-general-contractor/arvani-building-works-llc-0633-90359145,bbb.org
GTZ Construction Management Inc,,(305) 926-7904,600 NE 36th St Ste C4,"General Contractor, Construction, Home Renovation ...",,General Contractor,"Miami, FL",True,https://www.bbb.org/us/fl/miami/profile/general-contractor/gtz-construction-management-inc-0633-92028235,bbb.org
"JVP Construction Group,Inc",,(786) 478-6205,3095 NW 52nd St,"General Contractor, Roofing Contractors, Painting Contractors ...",,General Contractor,"Miami, FL",True,https://www.bbb.org/us/fl/miami/profile/general-contractor/jvp-construction-groupinc-0633-92035082,bbb.org
"A & F American Construction, LLC",,(786) 674-3035,5790 NW 35th Ave,"General Contractor, Roofing Contractors, Fence Contractors ...",,General Contractor,"Miami, FL",True,https://www.bbb.org/us/fl/miami/profile/general-contractor/a-f-american-construction-llc-0633-92059857,bbb.org
Maranata Construction Corp.,,3314333146,346 NW 57th Ave Apt J11,General Contractor,,General Contractor,"Miami, FL",True,https://www.bbb.org/us/fl/miami/profile/general-contractor/maranata-construction-corp-0633-90068450,bbb.org
DG Lux Hurricane Shutters & Impact Windows,,(786) 378-9690,,"Impact Windows, General Contractor, Shutters ...",,General Contractor,"Miami, FL",True,https://www.bbb.org/us/fl/miami/profile/impact-windows/dg-lux-hurricane-shutters-impact-windows-0633-90595942,bbb.org
"A & S Construction and Management, Inc.",,(786) 525-3460,1881 Washington Ave Suite 3H,"General Contractor, Construction, Home Additions ...",,General Contractor,"Miami, FL",True,https://www.bbb.org/us/fl/miami-beach/profile/general-contractor/a-s-construction-and-management-inc-0633-90080673,bbb.org
"Gulf Atlantic Industries of America, Inc.",,(305) 937-0500,,"General Contractor, Roofing Contractors, Deck Builder ...",,General Contractor,"Miami, FL",True,https://www.bbb.org/us/fl/miami-beach/profile/general-contractor/gulf-atlantic-industries-of-america-inc-0633-26002744,bbb.org
AJF Roofing Inc,,(305) 456-8006,7495 NW 7th St Ste 8,"Roofing Contractors, General Contractor, Metal Roofing Contractors ...",,General Contractor,"Miami, FL",True,https://www.bbb.org/us/fl/miami/profile/roofing-contractors/ajf-roofing-inc-0633-90364092,bbb.org
Art's Roofing & Construction,,(954) 526-1699,400 University Dr Ste 400,"General Contractor, Roofing Contractors, Metal Roofing Contractors ...",,General Contractor,"Miami, FL",True,https://www.bbb.org/us/fl/coral-gables/profile/general-contractor/arts-roofing-construction-0633-90605456,bbb.org
JMK Miami Contractor Corp,,(305) 422-9676,605 Lincoln Rd STE 250,General Contractor,,General Contractor,"Miami, FL",True,https://www.bbb.org/us/fl/miami-beach/profile/general-contractor/jmk-miami-contractor-corp-0633-92053884,bbb.org
"Level Up Roofing, Corp",,(305) 910-7185,,"Roofing Contractors, General Contractor, Metal Roofing Contractors ...",,General Contractor,"Miami, FL",True,https://www.bbb.org/us/fl/west-miami/profile/roofing-contractors/level-up-roofing-corp-0633-92033061,bbb.org
The Water Restoration Group,,(305) 661-2533,555 NW 95th Street,"Water Damage Restoration, General Contractor, Construction Services ...",,General Contractor,"Miami, FL",True,https://www.bbb.org/us/fl/miami/profile/water-damage-restoration/the-water-restoration-group-0633-90131483,bbb.org
"Alonso & Son GC, Inc.",,(305) 216-3683,472 SE 10th Ct,General Contractor,,General Contractor,"Miami, FL",True,https://www.bbb.org/us/fl/hialeah/profile/general-contractor/alonso-son-gc-inc-0633-90076047,bbb.org
Sun Eagle General Construction Inc,,(305) 773-5668,548 W 28th St,"General Contractor, Construction, Construction Management ...",,General Contractor,"Miami, FL",True,https://www.bbb.org/us/fl/hialeah/profile/general-contractor/sun-eagle-general-construction-inc-0633-90610111,bbb.org
"Ozzy's Golden Construction, Inc.",,(305) 968-1739,1441 E 8th Ct,"General Contractor, Home Builders, Remodel Contractors ...",,General Contractor,"Miami, FL",True,https://www.bbb.org/us/fl/hialeah/profile/general-contractor/ozzys-golden-construction-inc-0633-90564963,bbb.org
"Z Roofing, Inc.",,(305) 218-2605,2500 W 3rd Ct,"General Contractor, Roofing Contractors, Metal Roofing Contractors ...",,General Contractor,"Miami, FL",True,https://www.bbb.org/us/fl/hialeah/profile/general-contractor/z-roofing-inc-0633-4010222,bbb.org
All Dade Pavers Inc.,,(305) 432-3904,,"Paving Contractors, General Contractor, Patios and Decks ...",,General Contractor,"Miami, FL",True,https://www.bbb.org/us/fl/miami-springs/profile/paving-contractors/all-dade-pavers-inc-0633-92035841,bbb.org
"Oxx Group, LLC",,(786) 774-7435,7311 NW 12th St Ste 14,"Commercial Contractors, General Contractor, Building Contractors ...",,General Contractor,"Miami, FL",True,https://www.bbb.org/us/fl/doral/profile/commercial-contractors/oxx-group-llc-0633-90549332,bbb.org
Bigfoot Windows and Roofing,,(786) 312-1014,7250 SW 39th Ter,"General Contractor, Windows, Metal Roofing Contractors ...",,General Contractor,"Miami, FL",True,https://www.bbb.org/us/fl/miami/profile/general-contractor/bigfoot-windows-and-roofing-0633-90538785,bbb.org
Florida Entry Builders LLC,,(305) 564-3499,4950 SW 72nd Ave STE 120,"New Construction, General Contractor, Remodel Contractors ...",,General Contractor,"Miami, FL",True,https://www.bbb.org/us/fl/miami/profile/new-construction/florida-entry-builders-llc-0633-92034408,bbb.org
New Jupiter Construction Corp,,(786) 283-0085,6904 NE 3rd Ave,"General Contractor, Plumber, Fence Contractors ...",A+,General Contractor,"Miami, FL",True,https://www.bbb.org/us/fl/miami/profile/general-contractor/new-jupiter-construction-corp-0633-90603344/addressId/213353,bbb.org
CSM Contractors,,(305) 323-5330,987 NE 96th St,"General Contractor, Home Builders, Bathroom Remodel ...",,General Contractor,"Miami, FL",True,https://www.bbb.org/us/fl/miami-shores/profile/general-contractor/csm-contractors-0633-90086585,bbb.org
"Age of Empire, Inc.",,(305) 851-5897,8281 Coral Way,"General Contractor, Plumber, Waterproofing Contractors ...",,General Contractor,"Miami, FL",True,https://www.bbb.org/us/fl/miami/profile/general-contractor/age-of-empire-inc-0633-90045382,bbb.org
Standard Heating & Air Conditioning Inc,,5500155003,130 Plymouth Ave N,"Residential Air Conditioning Contractors, Heating and Air Conditioning, Air Conditioning Contractors ...",,HVAC Contractor,"Minneapolis, MN",True,https://www.bbb.org/us/mn/minneapolis/profile/residential-air-conditioning-contractors/standard-heating-air-conditioning-inc-0704-988,bbb.org
Roto-Rooter Plumbing & Water Cleanup,,(612) 788-9029,1629 Hennepin Ave STE 300G,"Plumber, Fire and Water Damage Restoration, Plumbing Renovation ...",A+,HVAC Contractor,"Minneapolis, MN",True,https://www.bbb.org/us/mn/minneapolis/profile/plumber/roto-rooter-plumbing-water-cleanup-0704-1000060716/addressId/280245,bbb.org
CenterPoint Energy,,5500155003,505 Nicollet Mall,"Natural Gas Companies, Heating and Air Conditioning, Air Conditioning Contractors ...",A+,HVAC Contractor,"Minneapolis, MN",True,https://www.bbb.org/us/mn/minneapolis/profile/natural-gas-companies/centerpoint-energy-0704-684/addressId/189295,bbb.org
Executive Remodeling,,5500355014,2649 Louisiana Ave S,"Construction Services, Roofing Contractors, General Contractor ...",,HVAC Contractor,"Minneapolis, MN",True,https://www.bbb.org/us/mn/st-louis-park/profile/construction-services/executive-remodeling-0704-96102274,bbb.org
"SPI Mechanical, LLC",,(763) 843-9825,,"Heating and Air Conditioning, Air Conditioning Contractors, Air Conditioning Repair ...",,HVAC Contractor,"Minneapolis, MN",True,https://www.bbb.org/us/mn/minneapolis/profile/heating-and-air-conditioning/spi-mechanical-llc-0704-1000044856,bbb.org
"Soderlin Plumbing, Heating & Air Conditioning",,(612) 721-4080,3612 Cedar Ave S,"Plumber, Heating and Air Conditioning, Air Conditioning Contractors ...",,HVAC Contractor,"Minneapolis, MN",True,https://www.bbb.org/us/mn/minneapolis/profile/plumber/soderlin-plumbing-heating-air-conditioning-0704-1878,bbb.org
"US Catastrophe, Inc.",,(763) 531-8000,,"Fire and Water Damage Restoration, Construction Services, Water Damage Restoration ...",,HVAC Contractor,"Minneapolis, MN",True,https://www.bbb.org/us/mn/brooklyn-center/profile/fire-water-damage-restoration/us-catastrophe-inc-0704-96018406,bbb.org
"Midwest Maintenance & Mechanical, Inc.",,5500155003,750 Pennsylvania Ave S,"Electrician, General Contractor, Construction Services ...",,HVAC Contractor,"Minneapolis, MN",True,https://www.bbb.org/us/mn/minneapolis/profile/electrician/midwest-maintenance-mechanical-inc-0704-43001174,bbb.org
"Restoreline, Inc.",,(612) 237-2181,4320 Toledo Ave N,"General Contractor, Roofing Contractors, Construction Services ...",,HVAC Contractor,"Minneapolis, MN",True,https://www.bbb.org/us/mn/robbinsdale/profile/general-contractor/restoreline-inc-0704-96535867,bbb.org
"Giertsen Company of Minnesota, Inc.",,(763) 546-1300,,"Fire and Water Damage Restoration, Roofing Contractors, General Contractor ...",,HVAC Contractor,"Minneapolis, MN",True,https://www.bbb.org/us/mn/golden-valley/profile/fire-water-damage-restoration/giertsen-company-of-minnesota-inc-0704-468,bbb.org
Jackson Family Heating and Cooling LLC,,(763) 221-8256,,"Heating and Air Conditioning, Air Conditioning Repair, Residential Air Conditioning Contractors ...",,HVAC Contractor,"Minneapolis, MN",True,https://www.bbb.org/us/mn/minneapolis/profile/heating-and-air-conditioning/jackson-family-heating-and-cooling-llc-0704-1000070443,bbb.org
"Norse Valhalla Construction, LLC",,(651) 251-7167,2355 Highway 36 W Ste 400,"Storm Damage Repair, Roofing Contractors, General Contractor ...",,HVAC Contractor,"Minneapolis, MN",True,https://www.bbb.org/us/mn/roseville/profile/storm-damage-repair/norse-valhalla-construction-llc-0704-1000045135,bbb.org
4Front Energy Inc.,,(952) 933-1868,3230 Gorham Ave,"Heating and Air Conditioning, Plumber, Electrical Contractors ...",,HVAC Contractor,"Minneapolis, MN",True,https://www.bbb.org/us/mn/saint-louis-park/profile/heating-and-air-conditioning/4front-energy-inc-0704-13002213,bbb.org
Ray N Welter Heating Company,,(612) 825-6867,4637 Chicago Ave,"Heating and Air Conditioning, Air Conditioning Contractors, Air Conditioning Repair ...",,HVAC Contractor,"Minneapolis, MN",True,https://www.bbb.org/us/mn/minneapolis/profile/heating-and-air-conditioning/ray-n-welter-heating-company-0704-16526,bbb.org
Total Comfort Heating & Cooling,,(888) 687-5882,,"Heating Contractors, Heating and Air Conditioning, Air Conditioning Contractors ...",,HVAC Contractor,"Minneapolis, MN",True,https://www.bbb.org/us/mn/golden-valley/profile/heating-contractors/total-comfort-heating-cooling-0704-2446,bbb.org
"Building Controls Group, LLC",,(651) 289-1310,2300 Myrtle Ave Ste 100,"Commercial Products Distributors, Heating and Air Conditioning, Air Conditioning Parts ...",,HVAC Contractor,"Minneapolis, MN",True,https://www.bbb.org/us/mn/saint-paul/profile/commercial-products-wholesale-and-distributor/building-controls-group-llc-0704-96545080,bbb.org
"Stafford Home Service, Inc.",,5501455016,6225 Cambridge St,"Electrician, Heating and Air Conditioning, Air Conditioning Contractors ...",,HVAC Contractor,"Minneapolis, MN",True,https://www.bbb.org/us/mn/minneapolis/profile/electrician/stafford-home-service-inc-0704-18372,bbb.org
Faircon Service Company,,(651) 203-0020,764 Vandalia St,"Heating and Air Conditioning, Heating Contractors, Mechanical Contractors ...",,HVAC Contractor,"Minneapolis, MN",True,https://www.bbb.org/us/mn/saint-paul/profile/heating-and-air-conditioning/faircon-service-company-0704-20000454,bbb.org
"Flare Heating & Air Conditioning, Inc.",,5500155003,9303 Plymouth Ave N Ste 104,"Heating and Air Conditioning, Air Conditioning Repair, Residential Air Conditioning Contractors ...",,HVAC Contractor,"Minneapolis, MN",True,https://www.bbb.org/us/mn/golden-valley/profile/heating-and-air-conditioning/flare-heating-air-conditioning-inc-0704-412,bbb.org
"GV Heating & Air, Inc.",,5501455016,5182 W Broadway Ave,"Heating and Air Conditioning, Air Conditioning Contractors, Air Conditioning Repair ...",,HVAC Contractor,"Minneapolis, MN",True,https://www.bbb.org/us/mn/crystal/profile/heating-and-air-conditioning/gv-heating-air-inc-0704-2025,bbb.org
Lindstrom Restoration,,5500155002,,"Fire and Water Damage Restoration, Water Damage Restoration, Fire Damage Restoration ...",,HVAC Contractor,"Minneapolis, MN",True,https://www.bbb.org/us/mn/plymouth/profile/fire-water-damage-restoration/lindstrom-restoration-0704-631,bbb.org
Ultra Clean Service Corporation,,(612) 263-9580,5501 Lakeland Ave N,"Carpet and Rug Cleaners, Cleaning Services, Mold Removal ...",B+,HVAC Contractor,"Minneapolis, MN",True,https://www.bbb.org/us/mn/crystal/profile/carpet-and-rug-cleaners/ultra-clean-service-corporation-0704-96549657/addressId/202958,bbb.org
Blue Yeti HVAC & Plumbing Services LLC,,(952) 222-8202,,"Heating and Air Conditioning, Plumber, Air Conditioning Contractors ...",A+,HVAC Contractor,"Minneapolis, MN",True,https://www.bbb.org/us/mn/edina/profile/heating-and-air-conditioning/blue-yeti-hvac-plumbing-services-llc-0704-1000043328/addressId/281210,bbb.org
"GTS HVAC, Inc.",,(612) 619-0589,4018 Joyce Ln,"Air Conditioning Contractors, Heating and Air Conditioning, Air Conditioning Repair ...",,HVAC Contractor,"Minneapolis, MN",True,https://www.bbb.org/us/mn/minneapolis/profile/air-conditioning-contractor/gts-hvac-inc-0704-96256795,bbb.org
Dean's Home Services,,5500155003,6701 Parkway Circle Suite 600,"Plumber, Heating and Air Conditioning, Air Conditioning Contractors ...",,HVAC Contractor,"Minneapolis, MN",True,https://www.bbb.org/us/mn/minneapolis/profile/plumber/deans-home-services-0704-21003446,bbb.org
"Marsh Heating & Air Conditioning Co., Inc.",,(763) 536-0667,6248 Lakeland Ave N Ste 110,"Heating and Air Conditioning, Air Conditioning Contractors, Heating Contractors",,HVAC Contractor,"Minneapolis, MN",True,https://www.bbb.org/us/mn/brooklyn-park/profile/heating-and-air-conditioning/marsh-heating-air-conditioning-co-inc-0704-11734,bbb.org
Pillar Construction,,(612) 423-7618,,"General Contractor, Construction Services, Fire and Water Damage Restoration",,HVAC Contractor,"Minneapolis, MN",True,https://www.bbb.org/us/mn/minneapolis/profile/general-contractor/pillar-construction-0704-1000011880,bbb.org
"Quality Refrigeration, Inc.",,(612) 861-7350,6237 Penn Ave S Ste 1,"Commercial Refrigeration, Heating and Air Conditioning, Air Conditioning Contractors ...",,HVAC Contractor,"Minneapolis, MN",True,https://www.bbb.org/us/mn/richfield/profile/commercial-refrigeration/quality-refrigeration-inc-0704-8005850,bbb.org
The Snelling Company,,5500155003,1400 Concordia Ave,"Heating and Air Conditioning, Electrician, Air Conditioning Contractors ...",,HVAC Contractor,"Minneapolis, MN",True,https://www.bbb.org/us/mn/saint-paul/profile/heating-and-air-conditioning/the-snelling-company-0704-1021,bbb.org
Spectrum Mechanical LLC,,(763) 537-9615,8912 47 1/2 Ave N,"Commercial Kitchen Renovations, Heating and Air Conditioning, Mechanical Contractors ...",,HVAC Contractor,"Minneapolis, MN",True,https://www.bbb.org/us/mn/new-hope/profile/commercial-kitchen-renovation/spectrum-mechanical-llc-0704-1000040338,bbb.org
Blue Ox Heating & Air,,5500155014,5720 International Pkwy,"Heating and Air Conditioning, Air Conditioning Contractors, Air Conditioning Repair ...",,HVAC Contractor,"Minneapolis, MN",True,https://www.bbb.org/us/mn/new-hope/profile/heating-and-air-conditioning/blue-ox-heating-air-0704-96386691,bbb.org
Rapid Restoration DKI,,(612) 239-7411,1900 County Road C W,"Fire Damage Restoration, General Contractor, Mold Removal ...",,HVAC Contractor,"Minneapolis, MN",True,https://www.bbb.org/us/mn/saint-paul/profile/fire-damage-restoration/rapid-restoration-dki-0704-96119012,bbb.org
"Cities 1 Plumbing, Heating & Air Conditioning",,5500155002,"Cities 1 Plumbing, Heating & Air Conditioning","Heating and Air Conditioning, Plumber, Air Conditioning Contractors ...",,HVAC Contractor,"Minneapolis, MN",True,https://www.bbb.org/us/mn/saint-paul/profile/heating-and-air-conditioning/cities-1-plumbing-heating-air-conditioning-0704-96174463,bbb.org
"Perzhu Construction, LLC",,5500155003,1006 Horn Drive,"Home Improvement, Roofing Contractors, General Contractor ...",A+,HVAC Contractor,"Minneapolis, MN",True,https://www.bbb.org/us/mn/hopkins/profile/home-improvement/perzhu-construction-llc-0704-96107011/addressId/185504,bbb.org
Wenzel Heating & Air Conditioning,,(651) 894-9898,614 Como Ave,"Heating and Air Conditioning, Air Conditioning Contractors, Air Conditioning Repair ...",A+,HVAC Contractor,"Minneapolis, MN",True,https://www.bbb.org/us/mn/saint-paul/profile/heating-and-air-conditioning/wenzel-heating-air-conditioning-0704-2324/addressId/3088,bbb.org
"Dave's Heating and Air Conditioning, LLC",,(612) 368-3315,888 W Co Rd D,"Heating and Air Conditioning, Air Conditioning Contractors, Heating Contractors ...",,HVAC Contractor,"Minneapolis, MN",True,https://www.bbb.org/us/mn/new-brighton/profile/heating-and-air-conditioning/daves-heating-and-air-conditioning-llc-0704-1000041418,bbb.org
"Ungerman, Inc.",,(612) 825-2800,,"Fire and Water Damage Restoration, General Contractor, Mold Removal ...",,HVAC Contractor,"Minneapolis, MN",True,https://www.bbb.org/us/mn/plymouth/profile/fire-water-damage-restoration/ungerman-inc-0704-18084,bbb.org
CSCI Inc,,(619) 810-1820,591 Camino de la Reina Ste 900,"Computer Repair, Information Technology Services, Security Systems ...",,IT Support,"San Diego, CA",True,https://www.bbb.org/us/ca/san-diego/profile/computer-repair/csci-inc-1126-101006,bbb.org
GreenmanITSupport,,(619) 573-9363,5663 Balboa Ave # 403,"Information Technology Services, Computer Hardware, Computer System Designers ...",,IT Support,"San Diego, CA",True,https://www.bbb.org/us/ca/san-diego/profile/information-technology-services/greenman-it-support-1126-172004891,bbb.org
TechiT Services,,(619) 764-6150,501 W Broadway Ste 800,"Information Technology Services, Computer Repair, Business Consultants ...",A+,IT Support,"San Diego, CA",True,https://www.bbb.org/us/ca/san-diego/profile/information-technology-services/techit-services-1126-172007608/addressId/448285,bbb.org
Simplicity IT,,(866) 771-7348,,"Information Technology Services, Computer Repair, Network Computers ...",,IT Support,"San Diego, CA",True,https://www.bbb.org/us/ca/el-cajon/profile/information-technology-services/simplicity-it-1126-1000149761,bbb.org
Branch 48 San Diego,,(503) 601-2228,Branch 48 San Diego,"Copiers, Security Cameras, Information Technology Services ...",A+,IT Support,"San Diego, CA",True,https://www.bbb.org/us/ca/san-diego/profile/copier/branch-48-san-diego-1126-1000143389/addressId/761899,bbb.org
CompuOne Corp,,(858) 404-7000,9888 Carroll Centre Rd Ste 201,"Computer Consultants, Computer Repair, Information Technology Services ...",,IT Support,"San Diego, CA",True,https://www.bbb.org/us/ca/san-diego/profile/computer-consultant/compuone-corp-1126-171992539,bbb.org
BizITy LLC,,(855) 424-9489,12751 Poway Rd Ste 103,"Managed Service Provider, Business Services, Computer Repair ...",,IT Support,"San Diego, CA",True,https://www.bbb.org/us/ca/poway/profile/managed-service-provider/bizity-llc-1126-1000122382,bbb.org
FYI SystemsITService &Support,,(858) 720-9400,12526 High Bluff Dr Ste 100,"Network Computers, Information Technology Services, Computers-Service & Repair",,IT Support,"San Diego, CA",True,https://www.bbb.org/us/ca/san-diego/profile/network-computer/fyisys-inc-1126-13002611,bbb.org
Quantum ERP Solutions,,(949) 373-5320,1540 S Coast Hwy Ste 201,"Computer Software, Information Technology Services, Computer Software Developers ...",,IT Support,"San Diego, CA",True,https://www.bbb.org/us/ca/laguna-beach/profile/computer-software/quantum-erp-solutions-1126-1000074677,bbb.org
Synergy Edge LLC,,(855) 343-5772,,"Managed Service Provider, Electrical Contractors, Business Services ...",,IT Support,"San Diego, CA",True,https://www.bbb.org/us/ca/menifee/profile/managed-service-provider/synergy-edge-llc-1126-850110112,bbb.org
Technijian,,(949) 379-8499,18 Technology Dr #141,"Computer System Designers, Information Technology Services, Tech Support ...",,IT Support,"San Diego, CA",True,https://www.bbb.org/us/ca/irvine/profile/computer-system-designers/technijian-1126-100046586,bbb.org
Innowest Technology LLC,,(949) 596-7000,20 Corporate Park Ste 118,"Information Technology Services, Computer Services, Tech Support",,IT Support,"San Diego, CA",True,https://www.bbb.org/us/ca/irvine/profile/information-technology-services/innowest-technology-llc-1126-1000159691,bbb.org
Branch 48 South California,,(503) 601-2228,Branch 48 South California,"Copiers, Security Cameras, Information Technology Services ...",A+,IT Support,"San Diego, CA",True,https://www.bbb.org/us/ca/orange/profile/copier/branch-48-south-california-1126-1000143385/addressId/761900,bbb.org
Twintel,,(888) 894-6411,12635 Hoover St,"Tech Support, Information Technology Services, Network Computers ...",,IT Support,"San Diego, CA",True,https://www.bbb.org/us/ca/garden-grove/profile/tech-support/twintel-1126-100080799,bbb.org
Provecta,,(909) 342-2175,,"Information Technology Services, Business Services, Network Computers ...",,IT Support,"San Diego, CA",True,https://www.bbb.org/us/ca/eastvale/profile/information-technology-services/provecta-1126-850075290,bbb.org
IT on the Dot LLC,,(657) 549-5638,1440 N Harbor Blvd Ste 900,"Computer Services, Computer Repair, Security Cameras ...",,IT Support,"San Diego, CA",True,https://www.bbb.org/us/ca/fullerton/profile/computer-services/it-on-the-dot-llc-1126-1000129621,bbb.org
Computer Pro2call,,(909) 525-4462,1902 Orange Tree Ln Ste 120,"Information Technology Services, Computer Repair, Computer Consultants ...",,IT Support,"San Diego, CA",True,https://www.bbb.org/us/ca/redlands/profile/information-technology-services/computer-pro2call-1126-850085421,bbb.org
"IT 21ST, LLC",,(855) 448-2178,10880 Wilshire Blvd STE 1101,"Information Technology Services, Computer Repair, Network Computers ...",A+,IT Support,"San Diego, CA",True,https://www.bbb.org/us/ca/los-angeles/profile/information-technology-services/it-21st-llc-1216-1290275/addressId/80648,bbb.org
Oaks Tech And Network Solutions,,(818) 991-1200,31316 Via Colinas Ste 103,"Low Voltage Contractors, Computer Repair, Information Technology Services ...",,IT Support,"San Diego, CA",True,https://www.bbb.org/us/ca/thousand-oaks/profile/low-voltage-contractors/oaks-tech-and-network-solutions-1236-92097775,bbb.org
Computer & Network Expert,,(818) 345-5674,2367 Cochran St,"Computer Consultants, Computer Repair, Information Technology Services ...",,IT Support,"San Diego, CA",True,https://www.bbb.org/us/ca/simi-valley/profile/computer-consultant/computer-network-expert-1236-92059929,bbb.org
Act USA,,(805) 370-8001,,"Network Security, Computer Repair, Information Technology Services ...",A+,IT Support,"San Diego, CA",True,https://www.bbb.org/us/ca/newbury-park/profile/network-security/act-usa-1236-3000893/addressId/31836,bbb.org
Computer Solutions,,(928) 343-9711,1700 S 1st Ave Ste 202,"Computer Repair, Information Technology Services, Network Computers ...",,IT Support,"San Diego, CA",True,https://www.bbb.org/us/az/yuma/profile/computer-repair/computer-solutions-1126-23002043,bbb.org
Roy Solutions,,(805) 669-1337,407 E Port Hueneme Rd PMB 17,"Computer Repair, Information Technology Services, Computer Consultants ...",,IT Support,"San Diego, CA",True,https://www.bbb.org/us/ca/port-hueneme/profile/computer-repair/roy-solutions-1236-92095320,bbb.org
ITSupportPros,,(619) 398-4100,3549 Camino Del Rio S #D,Information Technology Services,,IT Support,"San Diego, CA",False,https://www.bbb.org/us/ca/san-diego/profile/information-technology-services/excedeo-1126-31003255,bbb.org
Basic Business IT Consulting Services,,(844) 648-8856,,"Information Technology Services, Computer Consultants, Consultant ...",,IT Support,"San Diego, CA",False,https://www.bbb.org/us/ca/san-diego/profile/information-technology-services/basic-business-it-consulting-services-1126-1000109065,bbb.org
ibannieb Tech Support,,(619) 717-2958,,"Information Technology Services, Computer Repair, Network Computers ...",,IT Support,"San Diego, CA",False,https://www.bbb.org/us/ca/san-diego/profile/information-technology-services/ibannieb-tech-support-1126-172001091,bbb.org
Annexus Data Systems,,(858) 530-0019,8361 Vickers St #300,"Information Technology Services, Computer Repair, Network Computers ...",A+,IT Support,"San Diego, CA",False,https://www.bbb.org/us/ca/san-diego/profile/information-technology-services/annexus-data-systems-1126-13006339/addressId/263629,bbb.org
Sage IT Systems,,(877) 427-8278,10239 Veracruz Ct,"Tech Support, Information Technology Services, Network Computers ...",,IT Support,"San Diego, CA",False,https://www.bbb.org/us/ca/san-diego/profile/tech-support/sage-it-systems-1126-1000064276,bbb.org
Owls Computer Services,,(619) 800-3167,,"Computer Repair, Internet Services, Information Technology Services ...",,IT Support,"San Diego, CA",False,https://www.bbb.org/us/ca/san-diego/profile/computer-repair/owls-computer-services-1126-172006083,bbb.org
