company,website,phone,address,categories,rating,industry,location,accredited,bbb_link,source
Roof Tech Services LLC,,(971) 489-5418,,"Roofing Contractors, Concrete Contractors, Painting Contractors ...",,Painter,"Portland, OR",True,https://www.bbb.org/us/or/portland/profile/roofing-contractors/roof-tech-services-llc-1296-1000195356,bbb.org
1040 Window Remodeling LLC,,(971) 777-5107,1040 Window Remodeling LLC,"General Contractor, Painting Contractors, Home Builders ...",,Painter,"Portland, OR",True,https://www.bbb.org/us/wa/vancouver/profile/general-contractor/1040-window-remodeling-llc-1296-1000105580,bbb.org
Llanos Enterprises LLC,,(360) 241-8911,,"General Contractor, Painting Contractors, Residential Painter ...",,Painter,"Portland, OR",True,https://www.bbb.org/us/wa/vancouver/profile/general-contractor/llanos-enterprises-llc-1296-22956880,bbb.org
E & K Painting LLC,,9700297004,3515 Thompson Ave,"Painting Contractors, General Contractor, Siding Contractors ...",,Painter,"Portland, OR",True,https://www.bbb.org/us/wa/vancouver/profile/painting-contractors/e-k-painting-llc-1296-1000060108,bbb.org
Montoya's Painting LLC,,(503) 774-2792,,"Painting Contractors, Commercial Painting Contractors, Fence Staining ...",,Painter,"Portland, OR",True,https://www.bbb.org/us/or/happy-valley/profile/painting-contractors/montoyas-painting-llc-1296-1000116559,bbb.org
Tellez Remodeling LLC,,(971) 400-4910,"Tellez Remodeling LLC serves Vancouver WA and Portland, OR- within a 30 mile radius.","Remodel Contractors, General Contractor, Painting Contractors ...",,Painter,"Portland, OR",True,https://www.bbb.org/us/wa/vancouver/profile/remodel-contractors/tellez-remodeling-llc-1296-1000180060,bbb.org
Mervec Custom Painting LLC,,(503) 200-7788,,"Painting Contractors, Commercial Painting Contractors",,Painter,"Portland, OR",True,https://www.bbb.org/us/or/portland/profile/painting-contractors/mervec-custom-painting-llc--1296-1000075923,bbb.org
G & A Roofing LLC,,(971) 371-0727,,"Roofing Contractors, Gutters, Metal Roofing Contractors ...",,Painter,"Portland, OR",True,https://www.bbb.org/us/or/beaverton/profile/roofing-contractors/g-a-roofing-llc-1296-1000186876,bbb.org
Craftsman Construction,,(503) 998-8027,9850 SW Denney Rd,"Construction Services, General Contractor, Painting Contractors ...",,Painter,"Portland, OR",True,https://www.bbb.org/us/or/beaverton/profile/construction-services/craftsman-construction-1296-22040642,bbb.org
Coyote Painting LLC,,(503) 754-9550,,"Painting Contractors, Gutter Cleaning, Window Cleaning ...",A+,Painter,"Portland, OR",True,https://www.bbb.org/us/or/beaverton/profile/painting-contractors/coyote-painting-llc-1296-22717870/addressId/236318,bbb.org
"PDX Rose City Painting, LLC",,(503) 747-9947,4130 SW 117th Ave # 263,"Painting Contractors, Pressure Washing, Window Cleaning ...",A+,Painter,"Portland, OR",True,https://www.bbb.org/us/or/beaverton/profile/painting-contractors/pdx-rose-city-painting-llc-1296-1000061257/addressId/566343,bbb.org
Visionary Construction Services LLC,,(360) 713-1204,,"General Contractor, Painting Contractors, Bathroom Remodel ...",,Painter,"Portland, OR",True,https://www.bbb.org/us/wa/vancouver/profile/general-contractor/visionary-construction-services-llc-1296-1000185769,bbb.org
Three Diamond Painting,,(503) 884-0390,,"Painting Contractors, Residential Painter",,Painter,"Portland, OR",True,https://www.bbb.org/us/or/portland/profile/painting-contractors/three-diamond-painting-1296-1000164606,bbb.org
CanDo Painting Inc,,(503) 810-3587,118 Hillsdale Ln,"Commercial Painter, Painting Contractors, Commercial Painting Contractors ...",,Painter,"Portland, OR",True,https://www.bbb.org/us/or/silverton/profile/commercial-painter/cando-painting-inc-1296-22643706,bbb.org
Shepard Painting LLC,,(503) 740-3600,,"Painting Contractors, Carpenter, Property Maintenance",,Painter,"Portland, OR",True,https://www.bbb.org/us/or/lake-oswego/profile/painting-contractors/shepard-painting-llc-1296-75002140,bbb.org
Home Fleet Construction and Renovations LLC,,(360) 975-9817,,"Painting Contractors, General Contractor, Plumber ...",,Painter,"Portland, OR",True,https://www.bbb.org/us/wa/vancouver/profile/painting-contractors/home-fleet-construction-and-renovations-llc--1296-1000176836,bbb.org
AG Marketing Solutions,,(610) 337-8484,489 Shoemaker Rd Ste 111,"Digital Marketing, Marketing Consultant, Web Design ...",,Photographer,"Philadelphia, PA",True,https://www.bbb.org/us/pa/king-of-prussia/profile/digital-marketing/ag-marketing-solutions-0241-236103134,bbb.org
Dani Drew LLC,,(215) 292-0580,360 Woodhill Rd,"Photographer, Portrait Photographers, Wedding Photographers ...",,Photographer,"Philadelphia, PA",True,https://www.bbb.org/us/pa/newtown/profile/photographer/dani-drew-llc-0241-236090467,bbb.org
Kramer Photography Inc.,,0050100544,856 Route 206,"Photographer, Portrait Photographers, Photography Equipment",A-,Photographer,"Philadelphia, PA",True,https://www.bbb.org/us/nj/hillsborough/profile/photographer/kramer-photography-inc-0221-90179903/addressId/126702,bbb.org
Bob Gosselin Photography,,(410) 604-1195,213 Lime Landing Rd,Photographer,,Photographer,"Philadelphia, PA",True,https://www.bbb.org/us/md/millington/profile/photographer/bob-gosselin-photography-0011-90376430,bbb.org
YRN Designs & Photography,,(443) 432-9932,906 Bentgrass Dr,"Photographer, Videographers",A+,Photographer,"Philadelphia, PA",True,https://www.bbb.org/us/md/aberdeen/profile/photographer/yrn-designs-photography--0011-90369410/addressId/103664,bbb.org
"Little Mountain Printing, Inc",,(717) 933-8091,234 E Rosebud Rd,"Graphic Printing, Web Design, Web Hosting ...",,Photographer,"Philadelphia, PA",True,https://www.bbb.org/us/pa/myerstown/profile/graphic-printing/little-mountain-printing-inc-0241-236011258,bbb.org
Eye Photo/Em Photo Services,,(718) 816-7721,238 Bement Avenue,Commercial Photographer,,Photographer,"Philadelphia, PA",True,https://www.bbb.org/us/ny/staten-island/profile/commercial-photographer/eye-photoem-photo-services-0121-2518,bbb.org
Eye Photo,,(718) 816-7721,23 West 36 Street,Commercial Photographer,A+,Photographer,"Philadelphia, PA",True,https://www.bbb.org/us/ny/new-york/profile/commercial-photographer/eye-photo-0121-2518/addressId/113525,bbb.org
Maps Studio NYC,,(617) 466-9980,39 W 38th St Fl 11 C/O Maps Studio,Photographer,A-,Photographer,"Philadelphia, PA",True,https://www.bbb.org/us/ny/new-york/profile/photographer/maps-studio-nyc-0121-87150906/addressId/283276,bbb.org
"Belah Photography, LLC",,(347) 268-4607,,Photographer,,Photographer,"Philadelphia, PA",True,https://www.bbb.org/us/ny/springfield-gardens/profile/photographer/belah-photography-llc-0121-87182019,bbb.org
"Youth Sports Photo, Inc.",,(717) 724-0600,,"Sports Photographers, Photographer, Portrait Photographers",,Photographer,"Philadelphia, PA",True,https://www.bbb.org/us/pa/highspire/profile/sports-photographers/youth-sports-photo-inc-0241-170304617,bbb.org
Lawrence Photography & Video,,(718) 631-1021,4127 Corporal Kennedy St,"Commercial Photographer, Wedding Photographers",,Photographer,"Philadelphia, PA",True,https://www.bbb.org/us/ny/bayside/profile/commercial-photographer/lawrence-photography-video-0121-111373,bbb.org
Picture Perfect Muzic LLC,,(443) 299-2293,4131 Bedford Rd,"Photographer, Wedding Photographers, Photo Booth Rental ...",,Photographer,"Philadelphia, PA",True,https://www.bbb.org/us/md/pikesville/profile/photographer/picture-perfect-muzic-llc-0011-90287667,bbb.org
Rachel Smith Photography LLC,,(443) 695-3369,,"Photographer, Portrait Photographers, Wedding Photographers ...",,Photographer,"Philadelphia, PA",True,https://www.bbb.org/us/md/baltimore/profile/photographer/rachel-smith-photography-llc-0011-90271757,bbb.org
Enchanted Fairies,,(214) 607-3030,1065 Old Country Rd Ste 207,"Portrait Photographers, Photographer",A+,Photographer,"Philadelphia, PA",True,https://www.bbb.org/us/ny/westbury/profile/portrait-photographers/enchanted-fairies-0121-87174904/addressId/283141,bbb.org
Zen Agency,,(800) 775-9610,,"Web Design, Web Hosting, Photographer ...",,Photographer,"Philadelphia, PA",True,https://www.bbb.org/us/pa/duryea/profile/web-design/zen-agency-0241-235976096,bbb.org
"My Media Buzz, LLC",,(240) 495-3189,,"Audio-Visual Production Services, Photographer, Event Planner ...",,Photographer,"Philadelphia, PA",True,https://www.bbb.org/us/md/jessup/profile/audiovisual-production-services/my-media-buzz-llc-0011-90365469,bbb.org
SM Design,,(631) 306-4308,186 Massachusetts Ave,"Aerial Photographers, Photographer, Graphic Designer ...",,Photographer,"Philadelphia, PA",True,https://www.bbb.org/us/ny/bay-shore/profile/aerial-photographer/sm-design-0121-87177093,bbb.org
"Capture the Moment Photography by Ro, LLC",,(301) 346-1914,,"Photographer, Portrait Photographers, Wedding Photographers ...",,Photographer,"Philadelphia, PA",True,https://www.bbb.org/us/md/bowie/profile/photographer/capture-the-moment-photography-by-ro-llc-0241-236051192,bbb.org
AJF Media Group LLC,,(203) 219-3316,,"Advertising, Marketing Consultant, Web Design ...",A+,Photographer,"Philadelphia, PA",True,https://www.bbb.org/us/ct/stamford/profile/advertising/ajf-media-group-llc-0111-87129704/addressId/105790,bbb.org
Enchanted Fairies Studio LLC,,(214) 607-3030,,"Portrait Photographers, Photographer",A+,Photographer,"Philadelphia, PA",True,https://www.bbb.org/us/md/gaithersburg/profile/portrait-photographers/enchanted-fairies-studio-llc-0241-236085403/addressId/357949,bbb.org
Steph J Photography,,(703) 399-5319,643 S Washington St,"Photographer, Wedding Photographers, Commercial Photographer ...",,Photographer,"Philadelphia, PA",True,https://www.bbb.org/us/va/alexandria/profile/photographer/steph-j-photography-0241-236092718,bbb.org
Mattox Photography + Video,,(703) 578-0900,1727 King St Ste 300,Photographer,A+,Photographer,"Philadelphia, PA",True,https://www.bbb.org/us/va/alexandria/profile/photographer/mattox-photography-video-0241-193152005/addressId/213252,bbb.org
Clayton Jones Images,,(504) 326-5099,,"Photographer, Portrait Photographers, Wedding Photographers",,Photographer,"Philadelphia, PA",True,https://www.bbb.org/us/va/alexandria/profile/photographer/clayton-jones-images-0241-236103799,bbb.org
Emeritus Digital,,(332) 241-1452,42 Catharine Street,Photographer,,Photographer,"Philadelphia, PA",True,https://www.bbb.org/us/ny/poughkeepsie/profile/photographer/emeritus-digital--0121-87176885,bbb.org
"Jack Rose Imagery, LLC",,(203) 712-8835,64 Huntington St,"Photographer, Wedding Photographers, Wedding Videographer ...",,Photographer,"Philadelphia, PA",True,https://www.bbb.org/us/ct/shleton/profile/photographer/jack-rose-imagery-llc-0111-110094476,bbb.org
FTWINN Media,,(203) 364-7313,3 Horseshoe Ridge Rd,"Photographer, Videographers, Real Estate Photography",,Photographer,"Philadelphia, PA",True,https://www.bbb.org/us/ct/sandy-hook/profile/photographer/ftwinn-media-0111-110093542,bbb.org
"Disaster Relief Photography, LLC",,(203) 735-0242,,"Inventory Services, Photographer",,Photographer,"Philadelphia, PA",True,https://www.bbb.org/us/ct/shelton/profile/inventory-services/disaster-relief-photography-llc-0111-17005732,bbb.org
YFM Media Network LLC,,(240) 479-5583,9546 Hagel Cir,"Videographers, Photographer, Video Production Services ...",,Photographer,"Philadelphia, PA",True,https://www.bbb.org/us/va/lorton/profile/videographers/yfm-media-network-llc-0241-236093217,bbb.org
The Wedding Elites,,(959) 465-9481,100 Main St N # 147,"Wedding Photographers, Photographer, Portrait Photographers ...",,Photographer,"Philadelphia, PA",True,https://www.bbb.org/us/ct/southbury/profile/wedding-photographers/the-wedding-elites-0111-87065467,bbb.org
Chris Noel Photography LLC,,(475) 331-2113,576 Campbell Ave,Photographer,,Photographer,"Philadelphia, PA",True,https://www.bbb.org/us/ct/west-haven/profile/photographer/chris-noel-photography-llc-0111-110075996,bbb.org
AW Dronetech LLC,,(203) 361-2560,,"Drone Photographies, Photographer, Aerial Photographers ...",,Photographer,"Philadelphia, PA",True,https://www.bbb.org/us/ct/new-haven/profile/drone-photography/aw-dronetech-llc-0111-110096068,bbb.org
Merieta B. Photography,,(475) 441-8996,1175 State St Ste 209,Photographer,,Photographer,"Philadelphia, PA",True,https://www.bbb.org/us/ct/new-haven/profile/photographer/merieta-b-photography-0111-110088474,bbb.org
Pure White Lens Photography LLC,,(203) 668-1085,60 Connolly Pkwy Bldng 10C,"Photographer, Video Production Services, Wedding Photographers ...",,Photographer,"Philadelphia, PA",True,https://www.bbb.org/us/ct/hamden/profile/photographer/pure-white-lens-photography-llc-0111-110093072,bbb.org
Life View Video,,(202) 880-9377,7527 Presidential Ln,"Video Production Services, Commercial Photographer, Audio-Visual Production Services ...",,Photographer,"Philadelphia, PA",True,https://www.bbb.org/us/va/manassas/profile/video-production-services/life-view-video-0241-236101456,bbb.org
Kathy McGarry Photography,,(203) 230-0773,,"Photographer, Portrait Photographers, Wedding Photographers ...",,Photographer,"Philadelphia, PA",True,https://www.bbb.org/us/ct/north-haven/profile/photographer/kathy-mcgarry-photography-0111-87115742,bbb.org
The Lilith Clinic,,(206) 985-9553,,"Health and Wellness, Health Insurance, Medical Doctor ...",,Physician,"Seattle, WA",True,https://www.bbb.org/us/wa/seattle/profile/health-and-wellness/the-lilith-clinic-1296-22545864,bbb.org
Leidos QTC Health Services,,(909) 859-2100,13030 Military Rd S Ste 208,"Medical Doctor, Medical Plans",A+,Physician,"Seattle, WA",True,https://www.bbb.org/us/wa/tukwila/profile/medical-doctor/leidos-qtc-health-services-1296-22614519/addressId/446203,bbb.org
"Steven M Hall, MD",,(425) 557-7706,,"Functional Medicines, Health and Wellness, Medical Doctor ...",,Physician,"Seattle, WA",True,https://www.bbb.org/us/wa/issaquah/profile/functional-medicine/steven-m-hall-md-1296-1000193179,bbb.org
Sound Surgeons PLLC,,(425) 224-8200,,"Weight Reduction Physician, Health and Wellness, Veterinarian ...",,Physician,"Seattle, WA",True,https://www.bbb.org/us/wa/everett/profile/weight-reduction-physician/sound-surgeons-pllc-1296-22221957,bbb.org
Doc Bee Well,,(253) 777-3919,,"Physician Surgeon Family Practice, Health and Wellness, Telemedicine",,Physician,"Seattle, WA",True,https://www.bbb.org/us/wa/federal-way/profile/physician-surgeon-family-practice/doc-bee-well-1296-1000186015,bbb.org
South Puget Sound Neurology PLLC,,(253) 284-4488,5006 Center St Ste U,"Surgeons, Medical Doctor, Nutrition ...",,Physician,"Seattle, WA",True,https://www.bbb.org/us/wa/tacoma/profile/surgeons/south-puget-sound-neurology-pllc-1296-22756427,bbb.org
Trinity Family Medical Clinic,,(253) 881-1844,610 S Meridian,"Clinic, Medical Doctor, Skin Care ...",,Physician,"Seattle, WA",True,https://www.bbb.org/us/wa/puyallup/profile/clinic/trinity-family-medical-clinic-1296-1000079616,bbb.org
Concordia Star Medical PLLC,,(253) 250-3888,,"Medical Spa, Health and Wellness, Medical Doctor ...",,Physician,"Seattle, WA",True,https://www.bbb.org/us/wa/puyallup/profile/medical-spa/concordia-star-medical-pllc-1296-22729093,bbb.org
The Women's Clinic,,(253) 380-8905,11318 Bridgeport Way SW Ste A,"Direct Primary Care, Medical Doctor, Plastic Surgery ...",,Physician,"Seattle, WA",True,https://www.bbb.org/us/wa/lakewood/profile/direct-primary-care/the-womens-clinic-1296-1000126980,bbb.org
Olympia Multi-Specialty Clinic LLP,,(360) 704-3450,406 Black Hills Ln SW # A,"Specialists, Medical Doctor",,Physician,"Seattle, WA",True,https://www.bbb.org/us/wa/olympia/profile/specialists/olympia-multi-specialty-clinic-llp-1296-78001681,bbb.org
Black Hills Pediatrics Inc PS,,(360) 754-1629,2112 Caton Way SW,"Medical Doctor, Pediatrician",,Physician,"Seattle, WA",True,https://www.bbb.org/us/wa/olympia/profile/medical-doctor/black-hills-pediatrics-inc-ps-1296-22628785,bbb.org
Cynthia D Gray Md,,(360) 892-0096,2101 NE 139th St Ste 285,"Medical Doctor, Plastic Surgery",,Physician,"Seattle, WA",True,https://www.bbb.org/us/wa/vancouver/profile/medical-doctor/cynthia-d-gray-md-1296-22702736,bbb.org
Oregon Anesthesiology Group PC,,(503) 299-9906,707 SW Washington St Ste 700,"Anesthesiologists, Medical Doctor",,Physician,"Seattle, WA",True,https://www.bbb.org/us/or/portland/profile/anesthesiologist/oregon-anesthesiology-group-pc-1296-29025466,bbb.org
Multnomah Medical Clinic,,(503) 766-4338,9200 SE 91st Ave Ste 300,"Clinic, Medical Doctor, Erectile Dysfunction",,Physician,"Seattle, WA",True,https://www.bbb.org/us/or/happy-valley/profile/clinic/multnomah-medical-clinic-1296-1000108743,bbb.org
Aesthetic Medicine of Lake Oswego,,(503) 697-9777,4800 Meadows Rd Ste 100,"Medical Spa, Laser Hair Removal, Plastic Surgery ...",,Physician,"Seattle, WA",True,https://www.bbb.org/us/or/lake-oswego/profile/medical-spa/aesthetic-medicine-of-lake-oswego-1296-55000706,bbb.org
Lake Oswego Psychiatric Associates,,(503) 635-9336,4000 Kruse Way Pl Ste 2-200,"Psychiatrist, Medical Doctor, Psychotherapist ...",,Physician,"Seattle, WA",True,https://www.bbb.org/us/or/lake-oswego/profile/psychiatrist/lake-oswego-psychiatric-associates-1296-22604950,bbb.org
E Health International Inc,,(206) 448-4414,2800 Elliott Ave 1430,"Pediatrician, Weight Reduction Physician",,Physician,"Seattle, WA",False,https://www.bbb.org/us/wa/seattle/profile/pediatrician/e-health-international-inc-1296-22467296,bbb.org
Queen Anne Naturopathic Center,,(206) 281-4282,,"Medical Doctor, Alternative Medicine",,Physician,"Seattle, WA",False,https://www.bbb.org/us/wa/seattle/profile/medical-doctor/queen-anne-naturopathic-center-1296-22380517,bbb.org
Holistic Health West,,(206) 932-0880,,"Naturopath, Medical Doctor",,Physician,"Seattle, WA",False,https://www.bbb.org/us/wa/seattle/profile/naturopath/holistic-health-west-1296-22025118,bbb.org
Summit Consulting For Post Acute Care LLC,,(855) 269-3009,,"Medical Doctor, Internal Medicine",,Physician,"Seattle, WA",False,https://www.bbb.org/us/wa/seattle/profile/medical-doctor/summit-consulting-for-post-acute-care-llc--1296-1000170472,bbb.org
U W Medicine Belltown Clinic,,(206) 520-1550,,Medical Doctor,,Physician,"Seattle, WA",False,https://www.bbb.org/us/wa/seattle/profile/medical-doctor/u-w-medicine-belltown-clinic-1296-22229198,bbb.org
Kaiser Permanente of Washington,,(206) 442-4062,521 Wall St,"Clinic, Medical Doctor, HMOs",A+,Physician,"Seattle, WA",False,https://www.bbb.org/us/wa/seattle/profile/clinic/kaiser-permanente-of-washington-1296-502943/addressId/7367,bbb.org
SwedishPhysicianDivision,,(866) 747-2455,1533 Western Ave,"Hospital, Health and Wellness",A-,Physician,"Seattle, WA",False,https://www.bbb.org/us/wa/seattle/profile/hospital/providence-health-services-1296-13590/addressId/347725,bbb.org
"The Center for Classical Five Element Acupuncture, P.S.",,(206) 298-9376,1529 Queen Anne Ave N 100,"Acupuncturist, Medical Doctor",,Physician,"Seattle, WA",False,https://www.bbb.org/us/wa/seattle/profile/acupuncturist/the-center-for-classical-five-element-acupuncture-ps-1296-22463133,bbb.org
Footworks Physical Therapy,,(206) 632-4578,911 Western Ave 506,Medical Doctor,,Physician,"Seattle, WA",False,https://www.bbb.org/us/wa/seattle/profile/medical-doctor/footworks-physical-therapy-1296-22466827,bbb.org
Seattle Children's Hospital,,(206) 884-7800,,"Hospital, Health and Wellness, Medical Doctor ...",,Physician,"Seattle, WA",False,https://www.bbb.org/us/wa/seattle/profile/hospital/seattle-childrens-hospital-1296-22174086/addressId/88874,bbb.org
Immanence Health,,(206) 659-0690,1629 Queen Anne Avenue N Unit 104,Medical Doctor,,Physician,"Seattle, WA",False,https://www.bbb.org/us/wa/seattle/profile/medical-doctor/immanence-health--1296-1000176436,bbb.org
US HealthWorks Medical Group,,(425) 774-8758,,"Healthcare Management, Medical Doctor, Urgent Care Clinic ...",,Physician,"Seattle, WA",False,https://www.bbb.org/us/wa/seattle/profile/healthcare-management/us-healthworks-medical-group-1296-15025908/addressId/28393,bbb.org
Trust Women Seattle,,,,"Abortion Services, Medical Doctor, Clinic ...",,Physician,"Seattle, WA",False,https://www.bbb.org/us/wa/seattle/profile/abortion-services/trust-women-seattle-1296-1000051429,bbb.org
Seattle Sports & Regenerative Medicine PLLC,,(206) 620-0333,1000 Dexter Ave N Ste 320,"Medical Doctor, Sports Medicine",,Physician,"Seattle, WA",False,https://www.bbb.org/us/wa/seattle/profile/medical-doctor/seattle-sports-regenerative-medicine-pllc-1296-1000048016,bbb.org
US Stemology,,(206) 403-1223,,Medical Doctor,,Physician,"Seattle, WA",False,https://www.bbb.org/us/wa/seattle/profile/medical-doctor/us-stemology-1296-1000130854,bbb.org
Back Pain Clinic,,(206) 860-4329,,"Chiropractors D.C., Medical Doctor",,Physician,"Seattle, WA",False,https://www.bbb.org/us/wa/seattle/profile/chiropractors-dc/back-pain-clinic-1296-22169330,bbb.org
Premier Kitchen & Bath Remodeling,,6000460011,7125 W Gunnison St Ste 208,"General Contractor, Painting Contractors, Handyman ...",A+,Plumber,"Chicago, IL",True,https://www.bbb.org/us/il/harwood-heights/profile/general-contractor/premier-kitchen-bath-remodeling--0654-90014292/addressId/459601,bbb.org
"Ames Construction, Inc of Illinois",,(773) 379-2637,1016 W Jackson Blvd,"General Contractor, Roofing Contractors, Construction Services ...",,Plumber,"Chicago, IL",True,https://www.bbb.org/us/il/chicago/profile/general-contractor/ames-construction-inc-of-illinois-0654-38001111,bbb.org
"Rescue Plumbing, Inc.",,(773) 799-8848,839 N Winchester Ave Apt 2R,"Plumber, Plumbing Renovation, Sewer Cleaning ...",A+,Plumber,"Chicago, IL",True,https://www.bbb.org/us/il/chicago/profile/plumber/rescue-plumbing-inc-0654-90028307/addressId/320084,bbb.org
E R A Plumbing & Sewer  Inc,,(773) 849-3128,2445 S Kedzie Ave,"Plumber, Sewer Contractors",,Plumber,"Chicago, IL",True,https://www.bbb.org/us/il/chicago/profile/plumber/e-r-a-plumbing-sewer-inc-0654-1000050269,bbb.org
Trome Workz LLC,,(779) 400-9238,100 S State St Ste 414,"Construction, Plumber, Property Management ...",,Plumber,"Chicago, IL",True,https://www.bbb.org/us/il/chicago/profile/construction/trome-workz-llc-0654-1000127915,bbb.org
ProActiv Prevention Handyman Service,,(708) 465-7522,320 W Ohio St Ste 3W,"Handyman, Plumber, Heating and Air Conditioning ...",,Plumber,"Chicago, IL",True,https://www.bbb.org/us/il/chicago/profile/handyman/proactiv-prevention-handyman-service-0654-1000095527,bbb.org
Sewerserv Drain Solutions,,(773) 226-6911,2629 S Spaulding Ave,"Sewer Contractors, Plumber, Drainage Contractors ...",,Plumber,"Chicago, IL",True,https://www.bbb.org/us/il/chicago/profile/sewer-contractors/sewerserv-drain-solutions-0654-1000123345,bbb.org
"Sullivan Lane, Inc",,(312) 221-0814,180 N Stetson Ave Ste 3500,"General Contractor, Roofing Contractors, Plumber ...",,Plumber,"Chicago, IL",True,https://www.bbb.org/us/il/chicago/profile/general-contractor/sullivan-lane-inc-0654-1000012025,bbb.org
DRF,,(331) 701-4100,401 N Michigan Ave Ste 1200,"Plumber, Backflow Testing, Water Heater Repair ...",A+,Plumber,"Chicago, IL",True,https://www.bbb.org/us/il/chicago/profile/plumber/drf-0654-88023629/addressId/277978,bbb.org
Azteca Construction LLC,,(219) 334-5854,2432 S Hamlin Ave,"General Contractor, Painting Contractors, Electrician ...",,Plumber,"Chicago, IL",True,https://www.bbb.org/us/il/chicago/profile/general-contractor/azteca-construction-llc-0654-1000119407,bbb.org
JBCK Custom Homes Builders,,(773) 312-0588,925 N Lawndale Ave,"Plumber, Heating and Air Conditioning, Bathroom Remodel ...",A+,Plumber,"Chicago, IL",True,https://www.bbb.org/us/il/chicago/profile/plumber/jbck-custom-homes-builders-0654-90025455/addressId/349475,bbb.org
Quintana Construction,,(773) 587-5007,2614 S Karlov Ave Apt 1,"General Contractor, Concrete Contractors, Plumber ...",A-,Plumber,"Chicago, IL",True,https://www.bbb.org/us/il/chicago/profile/general-contractor/quintana-construction-0654-1000135791/addressId/476785,bbb.org
Sinks-N-Sumps Plumbing Service,,(866) 580-2600,2405 N Sheffield Ave,"Plumber, Plumbing Renovation, Sewer Cleaning ...",,Plumber,"Chicago, IL",True,https://www.bbb.org/us/il/chicago/profile/plumber/sinks-n-sumps-plumbing-service-0654-88560011,bbb.org
J. Blanton Plumbing,,(773) 242-8636,800 W Diversey Pkwy,"Plumber, Waterproofing Contractors, Drainage Contractors ...",,Plumber,"Chicago, IL",True,https://www.bbb.org/us/il/chicago/profile/plumber/j-blanton-plumbing-0654-1000115481,bbb.org
All Rooter Hydro Jetting Experts Inc,,4631146312,4900 S Tripp Ave,"Plumber, General Contractor, Drainage Contractors ...",,Plumber,"Chicago, IL",True,https://www.bbb.org/us/il/chicago/profile/plumber/all-rooter-hydro-jetting-experts-inc-0654-90028197,bbb.org
"Fix It Chicago, Inc.",,(312) 231-7533,,"General Contractor, Plumber, Heating and Air Conditioning ...",,Plumber,"Chicago, IL",True,https://www.bbb.org/us/il/oak-park/profile/general-contractor/fix-it-chicago-inc-0654-90025634,bbb.org
Topline HVAC Inc.,,(847) 440-5800,3807 N Western Ave,"Heating Contractors, Plumber, Heating and Air Conditioning ...",A+,Plumber,"Chicago, IL",True,https://www.bbb.org/us/il/chicago/profile/heating-contractors/topline-hvac-inc-0654-1000040244/addressId/437158,bbb.org
"Power Plumbing & Sewer Contractor, Inc.",,(773) 248-9574,3840 N Ashland Ave,"Plumber, Bathroom Remodel, Kitchen Remodel ...",,Plumber,"Chicago, IL",True,https://www.bbb.org/us/il/chicago/profile/plumber/power-plumbing-sewer-contractor-inc-0654-1001869,bbb.org
CT Plumbing LLC,,(773) 948-9175,,"Plumber, Plumbing Renovation, Backflow Testing ...",,Plumber,"Chicago, IL",True,https://www.bbb.org/us/il/chicago/profile/plumber/ct-plumbing-llc-0654-1000121685,bbb.org
"Thy Kingdom Plumbing, Inc.",,(312) 730-8475,,"Plumber, Electrician, Bathroom Remodel ...",,Plumber,"Chicago, IL",True,https://www.bbb.org/us/il/cicero/profile/plumber/thy-kingdom-plumbing-inc-0654-90025334,bbb.org
