company,website,phone,address,categories,rating,industry,location,accredited,bbb_link,source
Savitz Law Offices P.C.,,(617) 723-7111,6 Beacon St Ste 1015,"Immigration Lawyers, Lawyers, Attorneys & Lawyers",,Lawyer,"Boston, MA",True,https://www.bbb.org/us/ma/boston/profile/immigration-lawyer/savitz-law-offices-pc-0021-133382,bbb.org
"Murphy, Hesse, Toomey and Lehane, LLP",,(617) 479-5000,75 - 101 Federal St,"Lawyers, Estate Planning Attorneys, Real Estate Lawyers ...",A+,Lawyer,"Boston, MA",True,https://www.bbb.org/us/ma/boston/profile/lawyers/murphy-hesse-toomey-and-lehane-llp-0021-41876/addressId/765676,bbb.org
"Bowditch & Dewey, LLP",,(508) 791-3511,101 Federal St Ste 1405,"Lawyers, Estate Planning Attorneys, Real Estate Lawyers ...",A+,Lawyer,"Boston, MA",True,https://www.bbb.org/us/ma/boston/profile/lawyers/bowditch-dewey-llp-0021-537324/addressId/703470,bbb.org
FitzGerald Law Company,,(617) 523-6320,185 Devonshire St Ste 601,"Lawyers, Personal Injury Lawyers, Immigration Consultant ...",,Lawyer,"Boston, MA",True,https://www.bbb.org/us/ma/boston/profile/lawyers/fitzgerald-law-company-0021-133883,bbb.org
Sweeney Merrigan Personal Injury Lawyers,,(617) 391-9001,268 Summer Street LL,"Lawyers, Personal Injury Lawyers, Civil Lawyers ...",,Lawyer,"Boston, MA",True,https://www.bbb.org/us/ma/boston/profile/lawyers/sweeney-merrigan-personal-injury-lawyers-0021-188659,bbb.org
Nussbaum Law Group PC,,(857) 239-8161,44 School St Fl 6,"Lawyers, Personal Injury Lawyers, Legal Services",,Lawyer,"Boston, MA",True,https://www.bbb.org/us/ma/boston/profile/lawyers/nussbaum-law-group-pc-0021-243345,bbb.org
Earley Law Group Injury Lawyers,,(617) 338-7400,44 School St Ste 805,"Personal Injury Lawyers, Lawyers, Attorneys & Lawyers",,Lawyer,"Boston, MA",True,https://www.bbb.org/us/ma/boston/profile/personal-injury-lawyer/earley-law-group-injury-lawyers-0021-237950,bbb.org
Sokolove Law,,(800) 578-1413,44 School St Rm 400,"Lawyers, Personal Injury Lawyers, Attorneys & Lawyers",A+,Lawyer,"Boston, MA",True,https://www.bbb.org/us/ma/boston/profile/lawyers/sokolove-law-0021-98315/addressId/769345,bbb.org
"Law Office of John J. Sheehan, LLC.",,(781) 242-4100,10 Tremont St Ste 309,"Construction Accident Lawyers, Lawyers, Personal Injury Lawyers ...",A+,Lawyer,"Boston, MA",True,https://www.bbb.org/us/ma/boston/profile/construction-accident-lawyer/law-office-of-john-j-sheehan-llc-0021-129088/addressId/712155,bbb.org
Trupti N. Patel & Associates,,(617) 367-6750,201 Washington St Ste 2600,"Lawyers, Business Law Attorneys, Immigration Lawyers ...",A+,Lawyer,"Boston, MA",True,https://www.bbb.org/us/ma/boston/profile/lawyers/trupti-n-patel-associates-0021-415323/addressId/739598,bbb.org
"OneBoston Title & Closing Services, P.C.",,(800) 961-8685,1 Boston Pl Ste 2600,"Real Estate, Property Management, Real Estate Agents ...",,Lawyer,"Boston, MA",True,https://www.bbb.org/us/ma/boston/profile/real-estate/oneboston-title-closing-services-pc-0021-135245,bbb.org
"Calabrese Law Associates, PC",,(617) 340-6623,1 Boston Pl Ste 2600,"Lawyers, Real Estate Lawyers, Business Law Attorneys ...",,Lawyer,"Boston, MA",True,https://www.bbb.org/us/ma/boston/profile/lawyers/calabrese-law-associates-pc-0021-145557,bbb.org
"Turco Legal, P.C.",,(978) 225-9030,50 Congress St Ste 420,"Lawyers, Personal Injury Lawyers, Family Lawyers ...",A+,Lawyer,"Boston, MA",True,https://www.bbb.org/us/ma/boston/profile/lawyers/turco-legal-pc-0021-190566/addressId/745616,bbb.org
Larson Law,,(617) 932-6169,265 Franklin St Ste 1702,"Lawyers, Personal Injury Lawyers, Legal Services ...",,Lawyer,"Boston, MA",True,https://www.bbb.org/us/ma/boston/profile/lawyers/larson-law-0021-558856,bbb.org
"Joel H. Schwartz, P.C.",,(617) 742-1170,1 Washington Mall Ste 16,"Personal Injury Lawyers, Lawyers, Disability Lawyers ...",,Lawyer,"Boston, MA",True,https://www.bbb.org/us/ma/boston/profile/personal-injury-lawyer/joel-h-schwartz-pc-0021-20942,bbb.org
Jeffrey Glassman Injury Lawyers,,(617) 777-7777,1 International Pl Fl 18,"Lawyers, Personal Injury Lawyers, Attorneys & Lawyers",,Lawyer,"Boston, MA",True,https://www.bbb.org/us/ma/boston/profile/lawyers/jeffrey-glassman-injury-lawyers-0021-132877,bbb.org
DelMar Law Offices,,(617) 728-9800,"53 State Street, Suite 500","Business Law Attorneys, Lawyers, Employment Lawyers ...",,Lawyer,"Boston, MA",True,https://www.bbb.org/us/ma/boston/profile/business-law-attorney/delmar-law-offices-0021-84884,bbb.org
"Law Office of Johanna M. Herrero, LLC",,(617) 720-5200,100 Cambridge St,"Lawyers, Family Lawyers, Immigration Lawyers ...",,Lawyer,"Boston, MA",True,https://www.bbb.org/us/ma/boston/profile/lawyers/law-office-of-johanna-m-herrero-llc-0021-243307,bbb.org
Cervizzi & Associates,,(978) 276-0777,60 State St Ste 700,"Family Lawyers, Attorneys & Lawyers",A+,Lawyer,"Boston, MA",True,https://www.bbb.org/us/ma/boston/profile/family-lawyer/cervizzi-associates-0021-128488/addressId/349104,bbb.org
d'Oliveira & Associates,,(401) 431-1990,76 Canal St Ste 302,"Lawyers, Personal Injury Lawyers, Disability Lawyers ...",A+,Lawyer,"Boston, MA",True,https://www.bbb.org/us/ma/boston/profile/lawyers/doliveira-associates-0021-136111/addressId/760558,bbb.org
"Jason Stone Injury Lawyers, P.C.",,(617) 523-4357,225 Friend St Ste 301,"Lawyers, Personal Injury Lawyers, Legal Services",,Lawyer,"Boston, MA",True,https://www.bbb.org/us/ma/boston/profile/lawyers/jason-stone-injury-lawyers-pc-0021-97027,bbb.org
Mass Injury Group Injury and Accident Attorneys,,(617) 263-0060,15 Broad St,"Lawyers, Personal Injury Lawyers, Disability Lawyers ...",,Lawyer,"Boston, MA",True,https://www.bbb.org/us/ma/boston/profile/lawyers/mass-injury-group-injury-and-accident-attorneys-0021-186424,bbb.org
Michael Kelly Injury Lawyers,,(857) 425-8001,,"Personal Injury Lawyers, Attorneys & Lawyers",,Lawyer,"Boston, MA",True,https://www.bbb.org/us/ma/boston/profile/personal-injury-lawyer/michael-kelly-injury-lawyers-0021-143389,bbb.org
"Bellotti Law Group, P.C.",,(617) 225-2100,189 Cambridge St,"Lawyers, Personal Injury Lawyers, Estate Planning Attorneys ...",A+,Lawyer,"Boston, MA",True,https://www.bbb.org/us/ma/e-cambridge/profile/lawyers/bellotti-law-group-pc-0021-460747/addressId/719744,bbb.org
Altman & Altman LLP,,(617) 492-3000,689 Massachusetts Ave,"Lawyers, Personal Injury Lawyers, Criminal Lawyers ...",,Lawyer,"Boston, MA",True,https://www.bbb.org/us/ma/cambridge/profile/lawyers/altman-altman-llp-0021-113593,bbb.org
"Gavagan Law, LLC",,(617) 206-4747,1452 Dorchester Ave Ste 4,"Personal Injury Lawyers, Lawyers, Traffic Law Attorneys ...",,Lawyer,"Boston, MA",True,https://www.bbb.org/us/ma/dorchester/profile/personal-injury-lawyer/gavagan-law-llc-0021-560424,bbb.org
Law Offices of Kevin Seaver,,(617) 263-2633,8 Whittier Pl Ste 1A,"Lawyers, Family Lawyers, Child Support Enforcement ...",,Lawyer,"Boston, MA",True,https://www.bbb.org/us/ma/boston/profile/lawyers/law-offices-of-kevin-seaver-0021-164743,bbb.org
"SKM Title & Closing Services, PC",,(617) 277-7887,1583 Beacon Street,"Real Estate Lawyers, Lawyers, Title Agent ...",A+,Lawyer,"Boston, MA",True,https://www.bbb.org/us/ma/brookline/profile/real-estate-lawyer/skm-title-closing-services-pc-0021-40124/addressId/275722,bbb.org
Rob Levine Law,,(401) 357-0718,100 Hano St Ste 16,"Personal Injury Lawyers, Social Security Lawyers",A+,Lawyer,"Boston, MA",True,https://www.bbb.org/us/ma/allston/profile/personal-injury-lawyer/rob-levine-law-0021-109710/addressId/769775,bbb.org
Law Office of Matthew J. Kidd,,(617) 820-8400,12 Ericsson St Ste 201,"Lawyers, Personal Injury Lawyers, Civil Lawyers ...",,Lawyer,"Boston, MA",True,https://www.bbb.org/us/ma/boston/profile/lawyers/law-office-of-matthew-j-kidd-0021-238100,bbb.org
"Spada Law Group, LLC",,(617) 889-5000,111 Everett Ave Ste 1F,"Lawyers, Attorneys & Lawyers",,Lawyer,"Boston, MA",True,https://www.bbb.org/us/ma/chelsea/profile/lawyers/spada-law-group-llc-0021-238458,bbb.org
BOHAN,,(615) 327-1189,,"Advertising Agencies, Marketing Consultant, Marketing Programs ...",,Marketing Agency,"Nashville, TN",True,https://www.bbb.org/us/tn/nashville/profile/advertising-agencies/bohan-0573-15103058,bbb.org
"Wander Creative Productions, LLC",,(615) 933-9449,,"Digital Advertising, Marketing Consultant, Advertising Agencies ...",,Marketing Agency,"Nashville, TN",True,https://www.bbb.org/us/tn/nashville/profile/digital-advertising/wander-creative-productions-llc-0573-37310980,bbb.org
The John WayneAgency- Family Heritage Life,,(440) 922-5222,615 Main St Suite 210,"Insurance Companies, Life Insurance, Insurance Agency ...",A+,Marketing Agency,"Nashville, TN",True,https://www.bbb.org/us/tn/nashville/profile/insurance-companies/globe-life-family-heritage-division-0573-37076987/addressId/72526,bbb.org
"Dan Talent Group, Inc.",,(615) 591-7064,3820 Charlotte Ave Ste 146-15,"Talent Agencies, Advertising Agencies, Acting Classes ...",,Marketing Agency,"Nashville, TN",True,https://www.bbb.org/us/tn/nashville/profile/talent-agencies/dan-talent-group-inc-0573-37062508,bbb.org
Outfront Media,,(615) 256-4400,1431 Poplar Ln,"Advertising, Advertising Agencies, Advertising Specialties ...",,Marketing Agency,"Nashville, TN",True,https://www.bbb.org/us/tn/nashville/profile/advertising/outfront-media-0573-37088549,bbb.org
"Jucebox, LLC",,(615) 510-6499,11 Willow St.,"Marketing Consultant, Insurance Agency, Training Programs ...",,Marketing Agency,"Nashville, TN",True,https://www.bbb.org/us/tn/nashville/profile/marketing-consultant/jucebox-llc-0573-37262132,bbb.org
Moore Media,,(615) 800-7252,1016 Monroe Ln,"Advertising Agencies, Marketing Consultant, Marketing Programs ...",,Marketing Agency,"Nashville, TN",True,https://www.bbb.org/us/tn/brentwood/profile/advertising-agencies/moore-media-0573-37061886,bbb.org
The Gridwell Group,,(615) 266-3435,101 Creekstone Blvd Ste 100,"Design, Internet Marketing Services, Web Design ...",,Marketing Agency,"Nashville, TN",True,https://www.bbb.org/us/tn/franklin/profile/design/the-gridwell-group-0573-37379359,bbb.org
Navigation Advertising LLC,,(615) 898-1496,416 Medical Center Pkwy,"Digital Marketing, Marketing Programs, Advertising Agencies ...",,Marketing Agency,"Nashville, TN",True,https://www.bbb.org/us/tn/murfreesboro/profile/digital-marketing/navigation-advertising-llc-0573-37208788,bbb.org
Muletown DigitalMarketingAgency,,(931) 706-9268,200 Nicholas Long Drive Suite B,"Web Design, SEO Services, Digital Marketing ...",,Marketing Agency,"Nashville, TN",True,https://www.bbb.org/us/tn/columbia/profile/web-design/muletown-digital-marketing-agency-0573-37262562,bbb.org
"Beacon Digital, LLC",,(615) 224-8314,2399 Hurricane Creek Rd,"Advertising Agencies, Internet Marketing Services, Marketing Consultant ...",,Marketing Agency,"Nashville, TN",True,https://www.bbb.org/us/tn/woodbury/profile/advertising-agencies/beacon-digital-llc-0573-37375792,bbb.org
"Empty Tomb Graphics, LLC",,(256) 874-2471,,"Advertising Agencies, Web Design, Graphic Designer ...",,Marketing Agency,"Nashville, TN",True,https://www.bbb.org/us/al/athens/profile/advertising-agencies/empty-tomb-graphics-llc-0513-900006675,bbb.org
Active8 Communications,,(256) 489-2085,Active8 Communications,"Marketing Consultant, Advertising Agencies",,Marketing Agency,"Nashville, TN",True,https://www.bbb.org/us/al/huntsville/profile/marketing-consultant/active8-communications-0513-900237467,bbb.org
"TotalCom Marketing Communications, Inc.",,(256) 534-6383,708 Ward Ave NE,Advertising Agencies,,Marketing Agency,"Nashville, TN",True,https://www.bbb.org/us/al/huntsville/profile/advertising-agencies/totalcom-marketing-communications-inc-0513-5001130,bbb.org
"Mailings, Coupons & More, Inc.",,(256) 539-6761,,"Direct Mail Advertising, Advertising Agencies, Mailing Services ...",,Marketing Agency,"Nashville, TN",True,https://www.bbb.org/us/al/huntsville/profile/direct-mail-advertising/mailings-coupons-more-inc-0513-15000990,bbb.org
Lamar Advertising Company Inc-North Alabama,,(256) 533-6117,13 counties,"Outdoor Advertising, Information Technology Services, Advertising Agencies ...",,Marketing Agency,"Nashville, TN",True,https://www.bbb.org/us/al/huntsville/profile/outdoor-advertising/lamar-advertising-company-inc-north-alabama--0513-926,bbb.org
Cumulus Media Chattanooga,,(423) 756-6141,821 Pineville Rd,"Radio Advertising, Advertising Agencies, Radio Stations ...",,Marketing Agency,"Nashville, TN",True,https://www.bbb.org/us/tn/chattanooga/profile/radio-advertising/cumulus-media-chattanooga-0483-7614,bbb.org
Inview Graphics Corp.,,(423) 664-3000,,"Graphic Printing, Advertising Agencies, Signs ...",A+,Marketing Agency,"Nashville, TN",True,https://www.bbb.org/us/tn/chattanooga/profile/graphic-printing/inview-graphics-corp-0483-40081719/addressId/43259,bbb.org
"The Johnson Group, LLC",,(423) 267-0475,436 Market St,"Advertising Agencies, Marketing Consultant, SEO Services ...",,Marketing Agency,"Nashville, TN",True,https://www.bbb.org/us/tn/chattanooga/profile/advertising-agencies/the-johnson-group-llc-0483-38000017,bbb.org
Chattanooga Times Free Press,,(423) 757-6900,400 E 11th St,"Newspaper, Online Shopping, Internet Marketing Services ...",,Marketing Agency,"Nashville, TN",True,https://www.bbb.org/us/tn/chattanooga/profile/newspaper/chattanooga-times-free-press-0483-1646,bbb.org
Reagan Outdoor Advertising,,(423) 756-4200,18 W 28th St,"Outdoor Advertising, Advertising Agencies",,Marketing Agency,"Nashville, TN",True,https://www.bbb.org/us/tn/chattanooga/profile/outdoor-advertising/reagan-outdoor-advertising-0483-6395,bbb.org
"Bramblett Group, LLC",,(731) 989-8019,117 W Main St,"Advertising Agencies, Marketing Consultant, Web Design ...",,Marketing Agency,"Nashville, TN",True,https://www.bbb.org/us/tn/henderson/profile/advertising-agencies/bramblett-group-llc-0543-44028715,bbb.org
Greg Callaham Graphic Design,,(423) 316-9141,,"Graphic Designer, Advertising Agencies, Advertising Specialties ...",,Marketing Agency,"Nashville, TN",True,https://www.bbb.org/us/tn/chattanooga/profile/graphic-designer/greg-callaham-graphic-design-0483-40077819,bbb.org
Pro Logo Depot,,(423) 553-0800,515 Airport Rd STE 110,"Advertising Specialties, Screen Printing, Advertising Agencies ...",,Marketing Agency,"Nashville, TN",True,https://www.bbb.org/us/tn/chattanooga/profile/advertising-specialties/pro-logo-depot-0483-37000302,bbb.org
Century Printworks,,(423) 472-4543,1001 S Lee Hwy,"Printing Services, Screen Printing, Advertising Agencies ...",,Marketing Agency,"Nashville, TN",True,https://www.bbb.org/us/tn/cleveland/profile/printing-services/century-printworks-0483-14000245,bbb.org
"Media Mix Communication, Inc.",,(812) 473-0600,4630 Bayard Park Drive,"Advertising Agencies, Internet Marketing Services, Web Design ...",,Marketing Agency,"Nashville, TN",True,https://www.bbb.org/us/in/evansville/profile/advertising-agencies/media-mix-communication-inc-0482-90004015,bbb.org
"American Advertising Federation Louisville, Inc.",,(502) 895-2500,,"Advertising Agencies, Advertising Agencies & Counselors",,Marketing Agency,"Nashville, TN",True,https://www.bbb.org/us/ky/louisville/profile/advertising-agencies/american-advertising-federation-louisville-inc-0402-237,bbb.org
Traffick Media LLC,,(502) 614-6411,720 E Market St,"Advertising Agencies, Digital Marketing",,Marketing Agency,"Nashville, TN",True,https://www.bbb.org/us/ky/louisville/profile/advertising-agencies/traffick-media-llc-0402-235910990,bbb.org
Louisville Business First,,(502) 583-1731,500 W Jefferson St # 2315,"Newspaper, Advertising Agencies, Digital Advertising ...",,Marketing Agency,"Nashville, TN",True,https://www.bbb.org/us/ky/louisville/profile/newspaper/louisville-business-first-0402-1193,bbb.org
The Marketing Company,,(812) 944-7728,1100 East Spring Street,"Advertising Agencies, Marketing Consultant, Web Design ...",,Marketing Agency,"Nashville, TN",True,https://www.bbb.org/us/in/new-albany/profile/advertising-agencies/the-marketing-company-0402-4256,bbb.org
"Mediaura, Inc.",,(812) 590-9900,360 Spring Street,"Digital Marketing, Web Design, Advertising Agencies ...",,Marketing Agency,"Nashville, TN",True,https://www.bbb.org/us/in/jeffersonville/profile/digital-marketing/mediaura-inc-0402-2029680,bbb.org
Gunderson Marketing,,(502) 558-1717,119 S Sherrin Ave Ste 250,"Marketing Programs, Internet Marketing Services, Business Consultants ...",,Marketing Agency,"Nashville, TN",True,https://www.bbb.org/us/ky/louisville/profile/marketing-programs/gunderson-marketing-0402-159139958,bbb.org
Markexe,,(502) 398-9050,"Based out of&nbsp;<br>
Jefferson County, KY<br>
<br>
Available to Consult in all 50 states","Advertising, Internet Marketing Services, Marketing Consultant ...",,Marketing Agency,"Nashville, TN",True,https://www.bbb.org/us/ky/louisville/profile/advertising/markexe-0402-235919513,bbb.org
CJ Advertising,,(615) 254-6634,300 Tenth Avenue South,Advertising Agencies,A+,Marketing Agency,"Nashville, TN",False,https://www.bbb.org/us/tn/nashville/profile/advertising-agencies/cj-advertising-0573-37050369/addressId/57825,bbb.org
G7 Entertainment Marketing,,(615) 988-3417,G7 Entertainment Marketing,Advertising Agencies,,Marketing Agency,"Nashville, TN",False,https://www.bbb.org/us/tn/nashville/profile/advertising-agencies/g7-entertainment-marketing-0573-37201354,bbb.org
Tennessee Social,,(615) 881-2112,900 Church St,Advertising Agencies,,Marketing Agency,"Nashville, TN",False,https://www.bbb.org/us/tn/nashville/profile/advertising-agencies/tennessee-social-0573-37379055,bbb.org
Bill Hudson & Associates,,(615) 259-9002,814 Church St Ste 100,Advertising Agencies,,Marketing Agency,"Nashville, TN",False,https://www.bbb.org/us/tn/nashville/profile/advertising-agencies/bill-hudson-associates-0573-37066191,bbb.org
"The Buntin Group, Inc.",,(615) 244-5720,716 Division St,Advertising Agencies,A+,Marketing Agency,"Nashville, TN",False,https://www.bbb.org/us/tn/nashville/profile/advertising-agencies/the-buntin-group-inc-0573-10142/addressId/451,bbb.org
"Fivestone Studios, Inc.",,(615) 760-5428,1310 Clinton St STE 111,Advertising Agencies,,Marketing Agency,"Nashville, TN",False,https://www.bbb.org/us/tn/nashville/profile/advertising-agencies/fivestone-studios-inc-0573-37031919,bbb.org
"Advanced All Star Advertising, LLC",,(615) 207-4396,3201 Dickerson Pike Ste 141,Advertising Agencies,A+,Marketing Agency,"Nashville, TN",False,https://www.bbb.org/us/tn/nashville/profile/advertising-agencies/advanced-all-star-advertising-llc-0573-37012714/addressId/138718,bbb.org
Go Painting of Portland,,(971) 754-7880,,"Commercial Painting Contractors, Property Management, Property Maintenance ...",,Painter,"Portland, OR",True,https://www.bbb.org/us/or/portland/profile/commercial-painting-contractors/go-painting-of-portland-1296-1000192447,bbb.org
Castle Paint LLC,,(541) 275-0540,,Painting Contractors,,Painter,"Portland, OR",True,https://www.bbb.org/us/or/portland/profile/painting-contractors/castle-paint-llc-1296-1000192896,bbb.org
BVD Construction LLC,,(206) 446-1393,650 NE Holladay St,"General Contractor, Roofing Contractors, Painting Contractors ...",A+,Painter,"Portland, OR",True,https://www.bbb.org/us/or/portland/profile/general-contractor/bvd-construction-llc-1296-1000166803/addressId/815161,bbb.org
Euro Faux Painting LLC,,(503) 709-5209,,Painting Contractors,,Painter,"Portland, OR",True,https://www.bbb.org/us/or/portland/profile/painting-contractors/euro-faux-painting-llc-1296-22002699,bbb.org
Weinmann Painting Inc,,9703497035,3918 NE Multnomah St Unit A,Painting Contractors,,Painter,"Portland, OR",True,https://www.bbb.org/us/or/portland/profile/painting-contractors/weinmann-painting-inc-1296-75004836,bbb.org
"G & F Painting, Inc.",,(503) 278-5551,,"Painting Contractors, Residential Painter, Commercial Painting Contractors ...",,Painter,"Portland, OR",True,https://www.bbb.org/us/or/portland/profile/painting-contractors/g-f-painting-inc-1296-1000190466,bbb.org
Improvement Remodeling LLC,,(503) 515-3171,,"Construction Services, General Contractor, Concrete Contractors ...",,Painter,"Portland, OR",True,https://www.bbb.org/us/or/portland/profile/construction-services/improvement-remodeling-llc-1296-22150526,bbb.org
Exterior Barrier LLC,,(971) 246-0114,"Exterior Barrier LLC serves Portland, OR and surrounding areas within 25 miles.","General Contractor, Roofing Contractors, Painting Contractors ...",,Painter,"Portland, OR",True,https://www.bbb.org/us/or/portland/profile/general-contractor/exterior-barrier-llc-1296-1000065323,bbb.org
Aitech build & Paint LLC,,(971) 888-0840,3055 NW Yeon Ave,"General Contractor, Painting Contractors, Drywall Contractors ...",A+,Painter,"Portland, OR",True,https://www.bbb.org/us/or/portland/profile/general-contractor/aitech-build-paint-llc-1296-1000133964/addressId/872736,bbb.org
CertaPro Painters of Portland,,(503) 894-9379,3449 N Anchor St Ste 500,"Painting Contractors, Siding Contractors, Cabinet Refinishing ...",,Painter,"Portland, OR",True,https://www.bbb.org/us/or/portland/profile/painting-contractors/certapro-painters-of-portland-or-1296-1000031244,bbb.org
Happy Home Maintenance LLC,,9721197212,,"Home Maintenance, Painting Contractors, Handyman ...",A-,Painter,"Portland, OR",True,https://www.bbb.org/us/or/portland/profile/home-maintenance/happy-home-maintenance-llc-1296-1000188493/addressId/882263,bbb.org
Portlandia Handyman Services LLC,,(971) 400-1509,,"Handyman, General Contractor, Painting Contractors ...",,Painter,"Portland, OR",True,https://www.bbb.org/us/or/portland/profile/handyman/portlandia-handyman-services-llc-1296-1000063264,bbb.org
Blue Sky Paper Hanging & Painting Inc,,(503) 292-1001,,"Painting Contractors, Wallpaper Hangers, Wallpaper Removal ...",,Painter,"Portland, OR",True,https://www.bbb.org/us/or/portland/profile/painting-contractors/blue-sky-paper-hanging-painting-inc-1296-22043914,bbb.org
Assurant Exteriors,,(503) 484-0640,7640 NE Airport Way Unit 97238 Box,"Siding Contractors, Roofing Contractors, General Contractor ...",A+,Painter,"Portland, OR",True,https://www.bbb.org/us/or/portland/profile/siding-contractors/assurant-exteriors-1296-90002634/addressId/788718,bbb.org
Jantzen Beach Painting Services LLC,,(503) 522-9182,,"Construction, Painting Contractors, Pressure Washing ...",,Painter,"Portland, OR",True,https://www.bbb.org/us/or/portland/profile/construction/jantzen-beach-painting-services-llc-1296-1000130106,bbb.org
Benz Incorporated,,(971) 716-7273,,"Commercial Painting Contractors, Painting Contractors, Residential Painter ...",,Painter,"Portland, OR",True,https://www.bbb.org/us/or/portland/profile/commercial-painting-contractors/benz-incorporated-1296-1000066824,bbb.org
KVN Construction Inc,,9726698665,,"Siding Contractors, Roofing Contractors, Construction Services ...",,Painter,"Portland, OR",True,https://www.bbb.org/us/or/portland/profile/siding-contractors/kvn-construction-inc-1296-22788095,bbb.org
Tortoise Construction LLC,,(971) 800-0150,,"Remodel Contractors, General Contractor, Painting Contractors ...",,Painter,"Portland, OR",True,https://www.bbb.org/us/or/portland/profile/remodel-contractors/tortoise-construction-llc-1296-1000185720,bbb.org
Bathroom Surface Solutions LLC,,(503) 227-0826,,"Bathtub Refinishing, Painting Contractors, Bathroom Remodel ...",,Painter,"Portland, OR",True,https://www.bbb.org/us/or/portland/profile/bathtub-refinishing/bathroom-surface-solutions-llc-1296-22526253,bbb.org
Tuff & Stuff General Contractor LLC,,(503) 451-3041,,"General Contractor, Painting Contractors, Handyman ...",,Painter,"Portland, OR",True,https://www.bbb.org/us/or/portland/profile/general-contractor/tuff-stuff-general-contractor-llc-1296-1000192362,bbb.org
Sunrise Custom Painting LLC,,(503) 735-5223,,"Painting Contractors, Siding Contractors, Commercial Painting Contractors ...",,Painter,"Portland, OR",True,https://www.bbb.org/us/or/portland/profile/painting-contractors/sunrise-custom-painting-llc-1296-22480441,bbb.org
Roller Works Painting LLC,,(503) 820-8133,,"Painting Contractors, Cabinet Refinishing, Commercial Painting Contractors ...",,Painter,"Portland, OR",True,https://www.bbb.org/us/or/portland/profile/painting-contractors/roller-works-painting-llc-1296-1000141185,bbb.org
Forum Painting Inc,,(503) 705-6732,"Forum Painting Inc serves Portland, OR and surrounding areas within 40 miles.","Painting Contractors, Fire and Water Damage Restoration, Water Damage Restoration ...",,Painter,"Portland, OR",True,https://www.bbb.org/us/or/portland/profile/painting-contractors/forum-painting-inc-1296-75001343,bbb.org
Kairos PRC LLC,,(503) 764-5341,,"Remodel Contractors, General Contractor, Construction Services ...",,Painter,"Portland, OR",True,https://www.bbb.org/us/or/portland/profile/remodel-contractors/kairos-prc-llc-1296-22726929,bbb.org
J & P United Painting LLC,,(503) 784-6966,"J &amp; P United Painting LLC serves Portland, OR and surrounding areas within 100 miles.","Commercial Painting Contractors, Painting Contractors, Deck Repair ...",,Painter,"Portland, OR",True,https://www.bbb.org/us/or/milwaukie/profile/commercial-painting-contractors/j-p-united-painting-llc-1296-1000060346,bbb.org
Tommy Builders Inc,,(503) 440-9845,,"Residential General Contractor, General Contractor, Painting Contractors ...",,Painter,"Portland, OR",True,https://www.bbb.org/us/or/portland/profile/residential-general-contractor/tommy-builders-inc-1296-1000185998,bbb.org
Nesheim Family Remodeling LLC,,(907) 321-5744,"Nesheim Family Remodeling LLC will travel up to 50 miles from its location in Portland, OR.","General Contractor, Roofing Contractors, Painting Contractors ...",,Painter,"Portland, OR",True,https://www.bbb.org/us/or/portland/profile/general-contractor/nesheim-family-remodeling-llc-1296-1000184884,bbb.org
